tcpdump: WARNING: any: That device doesn't support promiscuous mode
(Promiscuous mode not supported on the "any" device)
tcpdump: listening on any, link-type LINUX_SLL2 (Linux cooked v2), snapshot length 262144 bytes
11:32:27.506389 enp37s0 Out IP (tos 0x0, ttl 64, id 0, offset 0, flags [DF], proto TCP (6), length 64)
    127.0.0.1.38357 > 1.1.1.1.443: Flags [S], cksum 0xf198 (correct), seq 9541077, win 65535, options [mss 1460,nop,wscale 7,nop,nop,sackOK,TS val 9541079 ecr 0,eol], length 0
11:42:39.372089 enp37s0 Out IP (tos 0x0, ttl 64, id 0, offset 0, flags [DF], proto TCP (6), length 60)
    192.168.1.2.60397 > 1.1.1.1.443: Flags [S], cksum 0xb79e (correct), seq 10152941, win 65535, options [mss 1460,sackOK,TS val 10152945 ecr 0,wscale 7,eol], length 0
11:42:39.383123 enp37s0 In  IP (tos 0x0, ttl 53, id 0, offset 0, flags [DF], proto TCP (6), length 60)
    1.1.1.1.443 > 192.168.1.2.60397: Flags [S.], cksum 0xda5e (correct), seq 2363779009, ack 10152942, win 65535, options [mss 1452,sackOK,TS val 2459917284 ecr 10152945,nop,wscale 13], length 0
11:42:39.383150 enp37s0 Out IP (tos 0x0, ttl 64, id 0, offset 0, flags [DF], proto TCP (6), length 40)
    192.168.1.2.60397 > 1.1.1.1.443: Flags [R], cksum 0x1203 (correct), seq 10152942, win 0, length 0
11:42:39.383369 enp37s0 Out IP (tos 0x0, ttl 64, id 0, offset 0, flags [DF], proto TCP (6), length 40)
    192.168.1.2.60397 > 1.1.1.1.443: Flags [.], cksum 0x1d50 (correct), ack 2363779010, win 65535, length 0
11:42:39.394232 enp37s0 In  IP (tos 0x0, ttl 53, id 0, offset 0, flags [DF], proto TCP (6), length 40)
    1.1.1.1.443 > 192.168.1.2.60397: Flags [R], cksum 0x09e5 (correct), seq 2363779010, win 0, length 0
11:43:26.443965 enp37s0 Out IP (tos 0x0, ttl 64, id 0, offset 0, flags [DF], proto TCP (6), length 60)
    192.168.1.2.41934 > 1.1.1.1.443: Flags [S], cksum 0x8ffb (correct), seq 10200014, win 65535, options [mss 1460,sackOK,TS val 10200017 ecr 0,wscale 7,eol], length 0
11:43:26.454595 enp37s0 In  IP (tos 0x0, ttl 54, id 0, offset 0, flags [DF], proto TCP (6), length 60)
    1.1.1.1.443 > 192.168.1.2.41934: Flags [S.], cksum 0xa7ca (correct), seq 2740691822, ack 10200015, win 65535, options [mss 1452,sackOK,TS val 1191010387 ecr 10200017,nop,wscale 13], length 0
11:43:26.454638 enp37s0 Out IP (tos 0x0, ttl 64, id 0, offset 0, flags [DF], proto TCP (6), length 40)
    192.168.1.2.41934 > 1.1.1.1.443: Flags [R], cksum 0xa240 (correct), seq 10200015, win 0, length 0
11:43:26.454898 enp37s0 Out IP (tos 0x0, ttl 64, id 0, offset 0, flags [DF], proto TCP (6), length 40)
    192.168.1.2.41934 > 1.1.1.1.443: Flags [.], cksum 0x5b69 (correct), ack 2740691823, win 65535, length 0
11:43:26.465142 enp37s0 In  IP (tos 0x0, ttl 54, id 0, offset 0, flags [DF], proto TCP (6), length 40)
    1.1.1.1.443 > 192.168.1.2.41934: Flags [R], cksum 0xffdf (correct), seq 2740691823, win 0, length 0
11:52:47.035565 enp37s0 Out IP (tos 0x0, ttl 64, id 0, offset 0, flags [DF], proto TCP (6), length 60)
    192.168.1.2.12698 > 1.1.1.1.443: Flags [S], cksum 0xe683 (correct), seq 10760602, win 65535, options [mss 1460,sackOK,TS val 10760608 ecr 0,wscale 7,eol], length 0
11:52:47.044579 enp37s0 In  IP (tos 0x0, ttl 54, id 0, offset 0, flags [DF], proto TCP (6), length 60)
    1.1.1.1.443 > 192.168.1.2.12698: Flags [S.], cksum 0x1745 (correct), seq 945510048, ack 10760603, win 65535, options [mss 1452,sackOK,TS val 2499195190 ecr 10760608,nop,wscale 13], length 0
11:52:47.044617 enp37s0 Out IP (tos 0x0, ttl 64, id 0, offset 0, flags [DF], proto TCP (6), length 40)
    192.168.1.2.12698 > 1.1.1.1.443: Flags [R], cksum 0x86a0 (correct), seq 10760603, win 0, length 0
11:52:47.044813 enp37s0 Out IP (tos 0x0, ttl 64, id 0, offset 0, flags [DF], proto TCP (6), length 40)
    192.168.1.2.12698 > 1.1.1.1.443: Flags [.], cksum 0xf797 (correct), ack 945510049, win 65535, length 0
11:52:47.048489 enp37s0 Out IP (tos 0x0, ttl 64, id 0, offset 0, flags [DF], proto TCP (6), length 1497)
    192.168.1.2.12698 > 1.1.1.1.443: Flags [P.], cksum 0x51c4 (correct), seq 10760603:10762060, ack 945510049, win 65535, length 1457
11:52:47.053605 enp37s0 In  IP (tos 0x0, ttl 54, id 0, offset 0, flags [DF], proto TCP (6), length 40)
    1.1.1.1.443 > 192.168.1.2.12698: Flags [R], cksum 0x29e3 (correct), seq 945510049, win 0, length 0
12:00rect), seq 10760603:10762060, ack 945510049, win 65535, length 1457
11:52:47.053605 enp37s0 In  IP (tos 0x0, ttl 54, id 0, offset 0, flags [DF], proto TCP (6), length 40)
    1.1.1.1.443 > 192.168.1.2.12698: Flags [R], cksum 0x29e3 (correct), seq 945510049, win 0, length 0
12:00:22.526363 enp37s0 Out IP (tos 0x0, ttl 64, id 0, offset 0, flags [DF], proto TCP (6), length 60)
    192.168.1.2.63244 > 1.1.1.1.443: Flags [S], cksum 0x3a7d (correct), seq 11216093, win 65535, options [mss 1460,sackOK,TS val 11216099 ecr 0,wscale 7,eol], length 0
12:00:22.536895 enp37s0 In  IP (tos 0x0, ttl 54, id 0, offset 0, flags [DF], proto TCP (6), length 60)
    1.1.1.1.443 > 192.168.1.2.63244: Flags [S.], cksum 0xf9ab (correct), seq 1152658204, ack 11216094, win 65535, options [mss 1452,sackOK,TS val 2322943093 ecr 11216099,nop,wscale 13], length 0
12:00:22.536948 enp37s0 Out IP (tos 0x0, ttl 64, id 0, offset 0, flags [DF], proto TCP (6), length 40)
    192.168.1.2.63244 > 1.1.1.1.443: Flags [R], cksum 0xcde3 (correct), seq 11216094, win 0, length 0
12:00:22.537223 enp37s0 Out IP (tos 0x0, ttl 64, id 0, offset 0, flags [DF], proto TCP (6), length 40)
    192.168.1.2.63244 > 1.1.1.1.443: Flags [.], cksum 0x5e06 (correct), ack 1152658205, win 65535, length 0
12:00:22.547405 enp37s0 In  IP (tos 0x0, ttl 54, id 0, offset 0, flags [DF], proto TCP (6), length 40)
    1.1.1.1.443 > 192.168.1.2.63244: Flags [R], cksum 0x839b (correct), seq 1152658205, win 0, length 0
12:00:36.684314 enp37s0 Out IP (tos 0x0, ttl 64, id 0, offset 0, flags [DF], proto TCP (6), length 60)
    192.168.1.2.55754 > 1.1.1.1.443: Flags [S], cksum 0xe923 (correct), seq 11230250, win 65535, options [mss 1460,sackOK,TS val 11230257 ecr 0,wscale 7,eol], length 0
12:00:36.695312 enp37s0 In  IP (tos 0x0, ttl 53, id 0, offset 0, flags [DF], proto TCP (6), length 60)
    1.1.1.1.443 > 192.168.1.2.55754: Flags [S.], cksum 0xc848 (correct), seq 1572407616, ack 11230251, win 65535, options [mss 1452,sackOK,TS val 4000960849 ecr 11230257,nop,wscale 13], length 0
12:00:36.695348 enp37s0 Out IP (tos 0x0, ttl 64, id 0, offset 0, flags [DF], proto TCP (6), length 40)
    192.168.1.2.55754 > 1.1.1.1.443: Flags [R], cksum 0xb3d8 (correct), seq 11230251, win 0, length 0
12:00:36.695637 enp37s0 Out IP (tos 0x0, ttl 64, id 0, offset 0, flags [DF], proto TCP (6), length 40)
    192.168.1.2.55754 > 1.1.1.1.443: Flags [.], cksum 0x4cd2 (correct), ack 1572407617, win 65535, length 0
12:00:36.706303 enp37s0 In  IP (tos 0x0, ttl 53, id 0, offset 0, flags [DF], proto TCP (6), length 40)
    1.1.1.1.443 > 192.168.1.2.55754: Flags [R], cksum 0xa9b4 (correct), seq 1572407617, win 0, length 0
12:05:46.257766 enp37s0 Out IP (tos 0x0, ttl 64, id 0, offset 0, flags [DF], proto TCP (6), length 60)
    192.168.1.2.65234 > 1.1.1.1.443: Flags [S], cksum 0x5188 (correct), seq 11539823, win 65535, options [mss 1460,sackOK,TS val 11539830 ecr 0,wscale 7,eol], length 0
12:05:46.268604 enp37s0 In  IP (tos 0x0, ttl 54, id 0, offset 0, flags [DF], proto TCP (6), length 60)
    1.1.1.1.443 > 192.168.1.2.65234: Flags [S.], cksum 0x49af (correct), seq 2789379940, ack 11539824, win 65535, options [mss 1452,sackOK,TS val 896377518 ecr 11539830,nop,wscale 13], length 0
12:05:46.268668 enp37s0 Out IP (tos 0x0, ttl 64, id 0, offset 0, flags [DF], proto TCP (6), length 40)
    192.168.1.2.65234 > 1.1.1.1.443: Flags [R], cksum 0xd586 (correct), seq 11539824, win 0, length 0
12:05:46.268995 enp37s0 Out IP (tos 0x0, ttl 64, id 0, offset 0, flags [DF], proto TCP (6), length 40)
    192.168.1.2.65234 > 1.1.1.1.443: Flags [.], cksum 0x9fd2 (correct), ack 2789379941, win 65535, length 0
12:05:46.279979 enp37s0 In  IP (tos 0x0, ttl 53, id 0, offset 0, flags [DF], proto TCP (6), length 40)
    1.1.1.1.443 > 192.168.1.2.65234: Flags [R], cksum 0xb5fe (correct), seq 2789379941, win 0, length 0
12:08:16.236229 enp37s0 Out IP (tos 0x0, ttl 64, id 0, offset 0, flags [DF], proto TCP (6), length 60)
    192.168.1.2.50953 > 1.1.1.1.443: Flags [S], cksum 0xf595 (correct), seq 11689803, win 65535, options [mss 1460,sackOK,TS val 11689809 ecr 0,wscale 7,eol], length 0
12:08:16.248203 enp37s0 In  IP (tos 0x0, ttl 54, id 0, offset 0, flags [DF], proto TCP (6), length 60)
    1.1.1.1.443 > 192.168.1.2.50953: Flags [S.], cksum 0xa087 (correct), seq 3788889543, ack 11689804, win 65535, options [mss 1452,sackOK,TS val 1587494075 ecr 11689809,nop,wscale 13], length 0
12:08:16.248235 enp37s0 Out IP (tos 0x0, ttl 64, id 0, offset 0, flags [DF], proto TCP (6), length 40)
    192.168.1.2.50953 > 1.1.1.1.443: Flags [R], cksum 0xc371 (correct), seq 11689804, win 0, length 0
12:08:16.248458 enp37s0 Out IP (tos 0x0, ttl 64, id 0, offset 0, flags [DF], proto TCP (6), length 40)
    192.168.1.2.50953 > 1.1.1.1.443: Flags [.], cksum 0x03c7 (correct), ack 3788889544, win 65535, length 0
12:08:16.259971 enp37s0 In  IP (tos 0x0, ttl 54, id 0, offset 0, flags [DF], proto TCP (6), length 40)
    1.1.1.1.443 > 192.168.1.2.50953: Flags [R], cksum 0x63d1 (correct), seq 3788889544, win 0, length 0
12:09:03.585751 enp37s0 Out IP (tos 0x0, ttl 64, id 40560, offset 0, flags [none], proto TCP (6), length 60)
    192.168.1.2.52614 > 1.1.1.1.443: Flags [S], cksum 0x7d2b (correct), seq 11737153, win 65535, options [mss 1460,sackOK,TS val 11737159 ecr 0,wscale 7,eol], length 0
12:09:03.597889 enp37s0 In  IP (tos 0x0, ttl 54, id 0, offset 0, flags [DF], proto TCP (6), length 60)
    1.1.1.1.443 > 192.168.1.2.52614: Flags [S.], cksum 0xa135 (correct), seq 1947332969, ack 11737154, win 65535, options [mss 1452,sackOK,TS val 2797720994 ecr 11737159,nop,wscale 13], length 0
12:09:03.597929 enp37s0 Out IP (tos 0x0, ttl 64, id 0, offset 0, flags [DF], proto TCP (6), length 40)
    192.168.1.2.52614 > 1.1.1.1.443: Flags [R], cksum 0x03fe (correct), seq 11737154, win 0, length 0
12:09:03.598145 enp37s0 Out IP (tos 0x0, ttl 64, id 40570, offset 0, flags [none], proto TCP (6), length 40)
    192.168.1.2.52614 > 1.1.1.1.443: Flags [.], cksum 0x9e75 (correct), ack 1947332970, win 65535, length 0
12:09:03.602073 enp37s0 Out IP (tos 0x0, ttl 64, id 40574, offset 0, flags [+], proto TCP (6), length 1492)
    192.168.1.2.52614 > 1.1.1.1.443: Flags [P.], seq 11737154:11738606, ack 1947332970, win 65535, length 1452
12:09:03.602079 enp37s0 Out IP (tos 0x0, ttl 64, id 40574, offset 1472, flags [none], proto TCP (6), length 25)
    192.168.1.2 > 1.1.1.1: ip-proto-6
12:09:03.609852 enp37s0 In  IP (tos 0x0, ttl 54, id 0, offset 0, flags [DF], proto TCP (6), length 40)
    1.1.1.1.443 > 192.168.1.2.52614: Flags [R], cksum 0xb776 (correct), seq 1947332970, win 0, length 0
12:09:03.613933 enp37s0 In  IP (tos 0x0, ttl 54, id 0, offset 0, flags [DF], proto TCP (6), length 40)
    1.1.1.1.443 > 192.168.1.2.52614: Flags [R], cksum 0xb776 (correct), seq 1947332970, win 0, length 0
12:09:24.316115 enp37s0 Out IP (tos 0x0, ttl 64, id 42436, offset 0, flags [none], proto TCP (6), length 60)
    192.168.1.2.65069 > 1.1.1.1.443: Flags [S], cksum 0xaa8f (correct), seq 11757883, win 65535, options [mss 1460,sackOK,TS val 11757889 ecr 0,wscale 7,eol], length 0
12:09:24.328793 enp37s0 In  IP (tos 0x0, ttl 54, id 0, offset 0, flags [DF], proto TCP (6), length 60)
    1.1.1.1.443 > 192.168.1.2.65069: Flags [S.], cksum 0xaebc (correct), seq 4194364521, ack 11757884, win 65535, options [mss 1452,sackOK,TS val 2323484884 ecr 11757889,nop,wscale 13], length 0
12:09:24.328827 enp37s0 Out IP (tos 0x0, ttl 64, id 0, offset 0, flags [DF], proto TCP (6), length 40)
    192.168.1.2.65069 > 1.1.1.1.443: Flags [R], cksum 0x825c (correct), seq 11757884, win 0, length 0
12:09:24.329077 enp37s0 Out IP (tos 0x0, ttl 64, id 42448, offset 0, flags [none], proto TCP (6), length 40)
    192.168.1.2.65069 > 1.1.1.1.443: Flags [.], cksum 0x9be4 (correct), ack 4194364522, win 65535, length 0
12:09:24.332680 enp37s0 Out IP (tos 0x0, ttl 64, id 42450, offset 0, flags [+], proto TCP (6), length 1492)
    192.168.1.2.65069 > 1.1.1.1.443: Flags [P.], seq 11757884:11759336, ack 4194364522, win 65535, length 1452
12:09:24.332688 enp37s0 Out IP (tos 0x0, ttl 64, id 42450, offset 1472, flags [none], proto TCP (6), length 25)
    192.168.1.2 > 1.1.1.1: ip-proto-6
12:09proto TCP (6), length 40)
    1.1.1.1.443 > 192.168.1.2.65069: Flags [R], cksum 0x05e0 (correct), seq 4194364522, win 0, length 0
12:15:47.233918 enp37s0 Out IP (tos 0x0, ttl 64, id 8969, offset 0, flags [none], proto TCP (6), length 60)
    192.168.1.2.52176 > 1.1.1.1.443: Flags [S], cksum 0x2d55 (correct), seq 12140801, win 65535, options [mss 1460,sackOK,TS val 12140807 ecr 0,wscale 7,eol], length 0
12:15:47.245153 enp37s0 In  IP (tos 0x0, ttl 53, id 0, offset 0, flags [DF], proto TCP (6), length 60)
    1.1.1.1.443 > 192.168.1.2.52176: Flags [S.], cksum 0x078e (correct), seq 2041015892, ack 12140802, win 65535, options [mss 1452,sackOK,TS val 2461905143 ecr 12140807,nop,wscale 13], length 0
12:15:47.245199 enp37s0 Out IP (tos 0x0, ttl 64, id 0, offset 0, flags [DF], proto TCP (6), length 40)
    192.168.1.2.52176 > 1.1.1.1.443: Flags [R], cksum 0xdced (correct), seq 12140802, win 0, length 0
12:15:47.245492 enp37s0 Out IP (tos 0x0, ttl 64, id 8970, offset 0, flags [none], proto TCP (6), length 40)
    192.168.1.2.52176 > 1.1.1.1.443: Flags [.], cksum 0xf4e4 (correct), ack 2041015893, win 65535, length 0
12:15:47.256169 enp37s0 In  IP (tos 0x0, ttl 53, id 0, offset 0, flags [DF], proto TCP (6), length 40)
    1.1.1.1.443 > 192.168.1.2.52176: Flags [R], cksum 0x36ac (correct), seq 2041015893, win 0, length 0
12:58:19.224995 enp37s0 Out IP (tos 0x0, ttl 64, id 17707, offset 0, flags [none], proto TCP (6), length 60)
    192.168.1.2.63899 > 1.1.1.1.443: Flags [S], cksum 0x1dcf (correct), seq 14692791, win 65535, options [mss 1460,sackOK,TS val 14692798 ecr 0,wscale 7,eol], length 0
12:58:19.236925 enp37s0 In  IP (tos 0x0, ttl 54, id 0, offset 0, flags [DF], proto TCP (6), length 60)
    1.1.1.1.443 > 192.168.1.2.63899: Flags [S.], cksum 0xbff5 (correct), seq 2944385361, ack 14692792, win 65535, options [mss 1452,sackOK,TS val 91352448 ecr 14692798,nop,wscale 13], length 0
12:58:19.236956 enp37s0 Out IP (tos 0x0, ttl 64, id 0, offset 0, flags [DF], proto TCP (6), length 40)
    192.168.1.2.63899 > 1.1.1.1.443: Flags [R], cksum 0xbe45 (correct), seq 14692792, win 0, length 0
12:58:19.237137 enp37s0 Out IP (tos 0x0, ttl 64, id 17715, offset 0, flags [none], proto TCP (6), length 40)
    192.168.1.2.63899 > 1.1.1.1.443: Flags [.], cksum 0x4d67 (correct), ack 2944385362, win 65535, length 0
12:58:19.240783 enp37s0 Out IP (tos 0x0, ttl 64, id 17716, offset 0, flags [none], proto TCP (6), length 1490)
    192.168.1.2.63899 > 1.1.1.1.443: Flags [P.], cksum 0x8ed8 (correct), seq 14692792:14694242, ack 2944385362, win 65535, length 1450
12:58:19.248423 enp37s0 In  IP (tos 0x0, ttl 54, id 0, offset 0, flags [DF], proto TCP (6), length 40)
    1.1.1.1.443 > 192.168.1.2.63899: Flags [R], cksum 0x800b (correct), seq 2944385362, win 0, length 0
12:58:19.252284 enp37s0 In  IP (tos 0x0, ttl 54, id 0, offset 0, flags [DF], proto TCP (6), length 40)
    1.1.1.1.443 > 192.168.1.2.63899: Flags [R], cksum 0x800b (correct), seq 2944385362, win 0, length 0
13:01:21.101097 enp37s0 Out IP (tos 0x0, ttl 64, id 44613, offset 0, flags [none], proto TCP (6), length 60)
    192.168.1.2.63615 > 1.1.1.1.443: Flags [S], cksum 0x91fc (correct), seq 14874668, win 65535, options [mss 1460,sackOK,TS val 14874674 ecr 0,wscale 7,eol], length 0
13:01:21.111911 enp37s0 In  IP (tos 0x0, ttl 54, id 0, offset 0, flags [DF], proto TCP (6), length 60)
    1.1.1.1.443 > 192.168.1.2.63615: Flags [S.], cksum 0xaf86 (correct), seq 2029523689, ack 14874669, win 65535, options [mss 1452,sackOK,TS val 2800858508 ecr 14874674,nop,wscale 13], length 0
13:01:21.111931 enp37s0 Out IP (tos 0x0, ttl 64, id 0, offset 0, flags [DF], proto TCP (6), length 40)
    192.168.1.2.63615 > 1.1.1.1.443: Flags [R], cksum 0xf8e9 (correct), seq 14874669, win 0, length 0
13:01:21.112141 enp37s0 Out IP (tos 0x0, ttl 64, id 44622, offset 0, flags [none], proto TCP (6), length 40)
    192.168.1.2.63615 > 1.1.1.1.443: Flags [.], cksum 0x6cfb (correct), ack 2029523690, win 65535, length 0
13:01:21.115895 enp37s0 Out IP (tos 0x0, ttl 64, id 44626, offset 0, flags [none], proto TCP (6), length 1490)
    192.168.1.2.63615 > 1.1.1.1.443: Flags [P.], cksum 0x4fd8 (correct), seq 14874669:14876119, ack 2029523690, win 65535, length 1450
13:01:21.122463 enp37s0 In  IP (tos 0x0, ttl 54, id 0, offset 0, flags [DF], proto TCP (6), length 40)
    1.1.1.1.443 > 192.168.1.2.63615: Flags [R], cksum 0x6617 (correct), seq 2029523690, win 0, length 0
13:01:21.126417 enp37s0 In  IP (tos 0x0, ttl 54, id 0, offset 0, flags [DF], proto TCP (6), length 40)
    1.1.1.1.443 > 192.168.1.2.63615: Flags [R], cksum 0x6617 (correct), seq 2029523690, win 0, length 0
13:01:38.594738 enp37s0 Out IP (tos 0x0, ttl 64, id 55718, offset 0, flags [none], proto TCP (6), length 60)
    192.168.1.2.52430 > 1.1.1.1.443: Flags [S], cksum 0x3501 (correct), seq 14892162, win 65535, options [mss 1460,sackOK,TS val 14892168 ecr 0,wscale 7,eol], length 0
13:01:38.605220 enp37s0 In  IP (tos 0x0, ttl 54, id 0, offset 0, flags [DF], proto TCP (6), length 60)
    1.1.1.1.443 > 192.168.1.2.52430: Flags [S.], cksum 0x2f0f (correct), seq 854187551, ack 14892163, win 65535, options [mss 1452,sackOK,TS val 645846100 ecr 14892168,nop,wscale 13], length 0
13:01:38.605259 enp37s0 Out IP (tos 0x0, ttl 64, id 0, offset 0, flags [DF], proto TCP (6), length 40)
    192.168.1.2.52430 > 1.1.1.1.443: Flags [R], cksum 0xe044 (correct), seq 14892163, win 0, length 0
13:01:38.605461 enp37s0 Out IP (tos 0x0, ttl 64, id 55727, offset 0, flags [none], proto TCP (6), length 40)
    192.168.1.2.52430 > 1.1.1.1.443: Flags [.], cksum 0xcf2e (correct), ack 854187552, win 65535, length 0
13:01:38.609301 enp37s0 Out IP (tos 0x0, ttl 64, id 55731, offset 0, flags [none], proto TCP (6), length 1490)
    192.168.1.2.52430 > 1.1.1.1.443: Flags [P.], cksum 0x2643 (correct), seq 14892163:14893613, ack 854187552, win 65535, length 1450
13:01:38.615748 enp37s0 In  IP (tos 0x0, ttl 54, id 0, offset 0, flags [DF], proto TCP (6), length 40)
    1.1.1.1.443 > 192.168.1.2.52430: Flags [R], cksum 0x0ca1 (correct), seq 854187552, win 0, length 0
13:01:38.619761 enp37s0 In  IP (tos 0x0, ttl 54, id 0, offset 0, flags [DF], proto TCP (6), length 40)
    1.1.1.1.443 > 192.168.1.2.52430: Flags [R], cksum 0x0ca1 (correct), seq 854187552, win 0, length 0
13:05:54.493944 enp37s0 Out IP (tos 0x0, ttl 64, id 50878, offset 0, flags [none], proto TCP (6), length 60)
    192.168.1.2.55230 > 1.1.1.1.443: Flags [S], cksum 0x5ad3 (correct), seq 15148061, win 65535, options [mss 1460,sackOK,TS val 15148067 ecr 0,wscale 7,eol], length 0
13:05:54.505834 enp37s0 In  IP (tos 0x0, ttl 54, id 0, offset 0, flags [DF], proto TCP (6), length 60)
    1.1.1.1.443 > 192.168.1.2.55230: Flags [S.], cksum 0x9e9a (correct), seq 2968468173, ack 15148062, win 65535, options [mss 1452,sackOK,TS val 2326875060 ecr 15148067,nop,wscale 13], length 0
13:05:54.505867 enp37s0 Out IP (tos 0x0, ttl 64, id 0, offset 0, flags [DF], proto TCP (6), length 40)
    192.168.1.2.55230 > 1.1.1.1.443: Flags [R], cksum 0xedb5 (correct), seq 15148062, win 0, length 0
13:05:54.506111 enp37s0 Out IP (tos 0x0, ttl 64, id 50883, offset 0, flags [none], proto TCP (6), length 40)
    192.168.1.2.55230 > 1.1.1.1.443: Flags [.], cksum 0x01ec (correct), ack 2968468174, win 65535, length 0
13:05:54.509963 enp37s0 Out IP (tos 0x0, ttl 64, id 50886, offset 0, flags [none], proto TCP (6), length 1497)
    192.168.1.2.55230 > 1.1.1.1.443: Flags [P.], cksum 0x623c (correct), seq 15148062:15149519, ack 2968468174, win 65535, length 1457
13:05:54.517458 enp37s0 In  IP (tos 0x0, ttl 54, id 0, offset 0, flags [DF], proto TCP (6), length 40)
    1.1.1.1.443 > 192.168.1.2.55230: Flags [R], cksum 0x26fd (correct), seq 2968468174, win 0, length 0
13:05:54.521675 enp37s0 In  IP (tos 0x0, ttl 54, id 0, offset 0, flags [DF], proto TCP (6), length 40)
    1.1.1.1.443 > 192.168.1.2.55230: Flags [R], cksum 0x26fd (correct), seq 2968468174, win 0, length 0
13:11:08.567807 enp37s0 Out IP (tos 0x0, ttl 64, id 57943, offset 0, flags [none], proto TCP (6), length 60)
    192.168.1.2.60455 > 1.1.1.1.443: Flags [S], cksum 0xb0ac (correct), seq 15462135, win 65535, options [mss 1460,sackOK,TS val 15462141 ecr 0,wscale 7,eol], length 0
13:11:08.578380 enp37s0 In  IP (tos 0x0, ttl 54, id 0, offset 0, flags [DF], proto TCP (6), length 60)
    1.1.1.1.443 > 192.168.1.2.60455: Flags [S.], cksum 0x5efb (correct), seq 427249350, ack 15462136, win 65535, options [mss 1452,sackOK,TS val 844938497 ecr 15462141,nop,wscale 13], length 0
13:11:08.578405 enp37s0 Out IP (tos 0x0, ttl 64, id 0, offset 0, flags [DF], proto TCP (6), length 40)
    192.168.1.2.60455 > 1.1.1.1.443: Flags [R], cksum 0x0e6e (correct), seq 15462136, win 0, length 0
13:11:08.578625 enp37s0 Out IP (tos 0x0, ttl 64, id 57952, offset 0, flags [none], proto TCP (6), length 40)
    192.168.1.2.60455 > 1.1.1.1.443: Flags [.], cksum 0xa623 (correct), ack 427249351, win 65535, length 0
13:11:08.582272 enp37s0 Out IP (tos 0x0, ttl 64, id 57955, offset 0, flags [none], proto TCP (6), length 1497)
    192.168.1.2.60455 > 1.1.1.1.443: Flags [P.], cksum 0xf4d2 (correct), seq 15462136:15463593, ack 427249351, win 65535, length 1457
13:11:08.588955 enp37s0 In  IP (tos 0x0, ttl 54, id 0, offset 0, flags [DF], proto TCP (6), length 40)
    1.1.1.1.443 > 192.168.1.2.60455: Flags [R], cksum 0x9613 (correct), seq 427249351, win 0, length 0
13:11:08.593141 enp37s0 In  IP (tos 0x0, ttl 54, id 0, offset 0, flags [DF], proto TCP (6), length 40)
    1.1.1.1.443 > 192.168.1.2.60455: Flags [R], cksum 0x9613 (correct), seq 427249351, win 0, length 0
13:13:50.236337 enp37s0 Out IP (tos 0x0, ttl 64, id 802, offset 0, flags [DF], proto ICMP (1), length 84)
    192.168.1.2 > 1.1.1.1: ICMP echo request, id 42964, seq 1, length 64
13:13:50.247090 enp37s0 In  IP (tos 0x0, ttl 54, id 31563, offset 0, flags [none], proto ICMP (1), length 84)
    1.1.1.1 > 192.168.1.2: ICMP echo reply, id 42964, seq 1, length 64
13:13:51.242117 enp37s0 Out IP (tos 0x0, ttl 64, id 1357, offset 0, flags [DF], proto ICMP (1), length 84)
    192.168.1.2 > 1.1.1.1: ICMP echo request, id 42964, seq 2, length 64
13:13:51.252876 enp37s0 In  IP (tos 0x0, ttl 54, id 47847, offset 0, flags [none], proto ICMP (1), length 84)
    1.1.1.1 > 192.168.1.2: ICMP echo reply, id 42964, seq 2, length 64
13:13:52.243940 enp37s0 Out IP (tos 0x0, ttl 64, id 1862, offset 0, flags [DF], proto ICMP (1), length 84)
    192.168.1.2 > 1.1.1.1: ICMP echo request, id 42964, seq 3, length 64
13:13:52.254848 enp37s0 In  IP (tos 0x0, ttl 54, id 5915, offset 0, flags [none], proto ICMP (1), length 84)
    1.1.1.1 > 192.168.1.2: ICMP echo reply, id 42964, seq 3, length 64
13:13:58.553225 enp37s0 Out IP (tos 0x0, ttl 64, id 53032, offset 0, flags [DF], proto TCP (6), length 60)
    192.168.1.2.46892 > 1.1.1.1.443: Flags [S], cksum 0xc3da (incorrect -> 0xe041), seq 1737289638, win 64240, options [mss 1460,sackOK,TS val 3677273556 ecr 0,nop,wscale 10], length 0
13:13:58.564938 enp37s0 In  IP (tos 0x0, ttl 54, id 0, offset 0, flags [DF], proto TCP (6), length 60)
    1.1.1.1.443 > 192.168.1.2.46892: Flags [S.], cksum 0x974c (correct), seq 1285254493, ack 1737289639, win 65535, options [mss 1452,sackOK,TS val 2465396462 ecr 3677273556,nop,wscale 13], length 0
13:13:58.564963 enp37s0 Out IP (tos 0x0, ttl 64, id 53033, offset 0, flags [DF], proto TCP (6), length 52)
    192.168.1.2.46892 > 1.1.1.1.443: Flags [.], cksum 0xc3d2 (incorrect -> 0xc5cb), ack 1285254494, win 63, options [nop,nop,TS val 3677273568 ecr 2465396462], length 0
13:13:58.565056 enp37s0 Out IP (tos 0x0, ttl 64, id 53034, offset 0, flags [DF], proto TCP (6), length 52)
    192.168.1.2.46892 > 1.1.1.1.443: Flags [F.], cksum 0xc3d2 (incorrect -> 0xc5ca), seq 1737289639, ack 1285254494, win 63, options [nop,nop,TS val 3677273568 ecr 2465396462], length 0
13:13:58.576383 enp37s0 In  IP (tos 0x0, ttl 54, id 29363, offset 0, flags [DF], proto TCP (6), length 52)
    1.1.1.1.443 > 192.168.1.2.46892: Flags [.], cksum 0xc5ee (correct), ack 1737289640, win 16, options [nop,nop,TS val 2465396473 ecr 3677273568], length 0
13:13:58.577397 enp37s0 In  IP (tos 0x0, ttl 54, id 29364, offset 0, flags [DF], proto TCP (6), length 52)
    1.1.1.1.443 > 192.168.1.2.46892: Flags [F.], cksum 0xc5ec (correct), seq 1285254494, ack 1737289640, win 16, options [nop,nop,TS val 2465396474 ecr 3677273568], length 0
13:13:58.577419 enp37s0 Out IP (tos 0x0, ttl 64, id 0, offset 0, flags [DF], proto TCP (6), length 52)
    192.168.1.2.46892 > 1.1.1.1.443: Flags [.], cksum 0xc5b1 (correct), ack 1285254495, win 63, options [nop,nop,TS val 3677273580 ecr 2465396474], length 0
13:23:30.636006 enp37s0 Out IP (tos 0x0, ttl 64, id 21144, offset 0, flags [none], proto TCP (6), length 60)
    192.168.1.2.53291 > 1.1.1.1.443: Flags [S], cksum 0x272f (correct), seq 16204198, win 65535, options [mss 1460,sackOK,TS val 16204209 ecr 0,wscale 7,eol], length 0
13:23:30.646738 enp37s0 In  IP (tos 0x0, ttl 54, id 0, offset 0, flags [DF], proto TCP (6), length 60)
    1.1.1.1.443 > 192.168.1.2.53291: Flags [S.], cksum 0x2afd (correct), seq 4222584944, ack 16204199, win 65535, options [mss 1452,sackOK,TS val 1592008471 ecr 16204209,nop,wscale 13], length 0
13:23:30.646760 enp37s0 Out IP (tos 0x0, ttl 64, id 0, offset 0, flags [DF], proto TCP (6), length 40)
    192.168.1.2.53291 > 1.1.1.1.443: Flags [R], cksum 0xd7af (correct), seq 16204199, win 0, length 0
13:23:31.631767 enp37s0 Out IP (tos 0x0, ttl 64, id 21987, offset 0, flags [none], proto TCP (6), length 40)
    192.168.1.2.53291 > 1.1.1.1.443: Flags [.], cksum 0x5382 (correct), ack 4222584945, win 65535, length 0
13:23:31.635306 enp37s0 Out IP (tos 0x0, ttl 64, id 21989, offset 0, flags [none], proto TCP (6), length 1497)
    192.168.1.2.53291 > 1.1.1.1.443: Flags [P.], cksum 0x110e (correct), seq 16204199:16205656, ack 4222584945, win 65535, length 1457
13:23:31.642616 enp37s0 In  IP (tos 0x0, ttl 54, id 0, offset 0, flags [DF], proto TCP (6), length 40)
    1.1.1.1.443 > 192.168.1.2.53291: Flags [R], cksum 0x962c (correct), seq 4222584945, win 0, length 0
13:23:31.646162 enp37s0 In  IP (tos 0x0, ttl 54, id 0, offset 0, flags [DF], proto TCP (6), length 40)
    1.1.1.1.443 > 192.168.1.2.53291: Flags [R], cksum 0x962c (correct), seq 4222584945, win 0, length 0
13:30:25.622802 enp37s0 Out IP (tos 0x0, ttl 64, id 52667, offset 0, flags [none], proto TCP (6), length 60)
    192.168.1.2.55550 > 1.1.1.1.443: Flags [S], cksum 0x7434 (correct), seq 16619190, win 65535, options [mss 1460,sackOK,TS val 16619196 ecr 0,wscale 7,eol], length 0
13:30:25.632936 enp37s0 In  IP (tos 0x0, ttl 53, id 0, offset 0, flags [DF], proto TCP (6), length 60)
    1.1.1.1.443 > 192.168.1.2.55550: Flags [S.], cksum 0xaa6c (correct), seq 3324184422, ack 16619191, win 65535, options [mss 1452,sackOK,TS val 1850119137 ecr 16619196,nop,wscale 13], length 0
13:30:25.632955 enp37s0 Out IP (tos 0x0, ttl 64, id 0, offset 0, flags [DF], proto TCP (6), length 40)
    192.168.1.2.55550 > 1.1.1.1.443: Flags [R], cksum 0x79c6 (correct), seq 16619191, win 0, length 0
13:30:25.633149 enp37s0 Out IP (tos 0x0, ttl 64, id 52671, offset 0, flags [none], proto TCP (6), length 40)
    192.168.1.2.55550 > 1.1.1.1.443: Flags [.], cksum 0xac2f (correct), ack 3324184423, win 65535, length 0
13:30:25.642964 enp37s0 In  IP (tos 0x0, ttl 53, id 0, offset 0, flags [DF], proto TCP (6), length 40)
    1.1.1.1.443 > 192.168.1.2.55550: Flags [R], cksum 0x43f0 (correct), seq 3324184423, win 0, length 0
13:30:25.646007 enp37s0 Out IP (tos 0x0, ttl 64, id 52676, offset 0, flags [none], proto TCP (6), length 1495)
    192.168.1.2.55550 > 1.1.1.1.443: Flags [P.], cksum 0x17cc (correct), seq 16619191:16620646, ack 3324184423, win 65535, length 1455
13:30:25.656170 enp37s0 In  IP (tos 0x0, ttl 53, id 0, offset 0, flags [DF], proto TCP (6), length 40)
    1.1.1.1.443 > 192.168.1.2.55550: Flags [R], cksum 0x43f0 (correct), seq 3324184423, win 0, length 0
14:22:54.081547 enp37s0 Out IP (tos 0x0, ttl 64, id 30070, offset 0, flags [none], proto TCP (6), length 60)
    192.168.1.2.55171 > 1.1.1.1.443: Flags [S], cksum 0x5ffd (correct), seq 19767646, win 65535, options [mss 1460,sackOK,TS val 19767654 ecr 0,wscale 7,eol], length 0
14:22:54.090684 enp37s0 In  IP (tos 0x0, ttl 54, id 0, offset 0, flags [DF], proto TCP (6), length 60)
    1.1.1.1.443 > 192.168.1.2.55171: Flags [S.], cksum 0x7826 (correct), seq 7495072, ack 19767647, win 65535, options [mss 1452,sackOK,TS val 2525690147 ecr 19767654,nop,wscale 13], length 0
14:22:54.090703 enp37s0 Out IP (tos 0x0, ttl 64, id 0, offset 0, flags [DF], proto TCP (6), length 40)
    192.168.1.2.55171 > 1.1.1.1.443: Flags [R], cksum 0x7069 (correct), seq 19767647, win 0, length 0
14:22:54.090828 enp37s0 Out IP (tos 0x0, ttl 64, id 30079, offset 0, flags [none], proto TCP (6), length 40)
    192.168.1.2.55171 > 1.1.1.1.443: Flags [.], cksum 0x124a (correct), ack 7495073, win 65535, length 0
14:22:54.099793 enp37s0 In  IP (tos 0x0, ttl 54, id 0, offset 0, flags [DF], proto TCP (6), length 40)
    1.1.1.1.443 > 192.168.1.2.55171: Flags [R], cksum 0xb4e2 (correct), seq 7495073, win 0, length 0
14:23:23.252692 enp37s0 Out IP (tos 0x0, ttl 64, id 33396, offset 0, flags [none], proto TCP (6), length 60)
    192.168.1.2.56235 > 1.1.1.1.443: Flags [S], cksum 0x77ea (correct), seq 19796820, win 65535, options [mss 1460,sackOK,TS val 19796826 ecr 0,wscale 7,eol], length 0
14:23:23.261870 enp37s0 In  IP (tos 0x0, ttl 54, id 0, offset 0, flags [DF], proto TCP (6), length 60)
    1.1.1.1.443 > 192.168.1.2.56235: Flags [S.], cksum 0x798d (correct), seq 3021590837, ack 19796821, win 65535, options [mss 1452,sackOK,TS val 1853296768 ecr 19796826,nop,wscale 13], length 0
14:23:23.261892 enp37s0 Out IP (tos 0x0, ttl 64, id 0, offset 0, flags [DF], proto TCP (6), length 40)
    192.168.1.2.56235 > 1.1.1.1.443: Flags [R], cksum 0xfa4a (correct), seq 19796821, win 0, length 0
14:23:23.262046 enp37s0 Out IP (tos 0x0, ttl 64, id 33405, offset 0, flags [none], proto TCP (6), length 40)
    192.168.1.2.56235 > 1.1.1.1.443: Flags [.], cksum 0x74ee (correct), ack 3021590838, win 65535, length 0
14:23:23.270877 enp37s0 In  IP (tos 0x0, ttl 54, id 0, offset 0, flags [DF], proto TCP (6), length 40)
    1.1.1.1.443 > 192.168.1.2.56235: Flags [R], cksum 0x897d (correct), seq 3021590838, win 0, length 0
14:24:59.097092 enp37s0 Out IP (tos 0x0, ttl 64, id 31560, offset 0, flags [none], proto TCP (6), length 60)
    192.168.1.2.54110 > 1.1.1.1.443: Flags [S], cksum 0x936c (correct), seq 19892664, win 65535, options [mss 1460,sackOK,TS val 19892670 ecr 0,wscale 7,eol], length 0
14:24:59.108219 enp37s0 In  IP (tos 0x0, ttl 54, id 0, offset 0, flags [DF], proto TCP (6), length 60)
    1.1.1.1.443 > 192.168.1.2.54110: Flags [S.], cksum 0x2ea0 (correct), seq 1535734588, ack 19892665, win 65535, options [mss 1452,sackOK,TS val 4094011370 ecr 19892670,nop,wscale 13], length 0
14:24:59.108255 enp37s0 Out IP (tos 0x0, ttl 64, id 0, offset 0, flags [DF], proto TCP (6), length 40)
    192.168.1.2.54110 > 1.1.1.1.443: Flags [R], cksum 0x8c32 (correct), seq 19892665, win 0, length 0
14:24:59.108457 enp37s0 Out IP (tos 0x0, ttl 64, id 31561, offset 0, flags [none], proto TCP (6), length 40)
    192.168.1.2.54110 > 1.1.1.1.443: Flags [.], cksum 0xbd5f (correct), ack 1535734589, win 65535, length 0
14:24:59.119288 enp37s0 In  IP (tos 0x0, ttl 54, id 0, offset 0, flags [DF], proto TCP (6), length 40)
    1.1.1.1.443 > 192.168.1.2.54110: Flags [R], cksum 0x4854 (correct), seq 1535734589, win 0, length 0
14:26:40.625571 enp37s0 Out IP (tos 0x0, ttl 64, id 50549, offset 0, flags [none], proto TCP (6), length 60)
    192.168.1.2.58498 > 1.1.1.1.443: Flags [S], cksum 0x6915 (correct), seq 19994192, win 65535, options [mss 1460,sackOK,TS val 19994198 ecr 0,wscale 7,eol], length 0
14:26:40.636364 enp37s0 In  IP (tos 0x0, ttl 54, id 0, offset 0, flags [DF], proto TCP (6), length 60)
    1.1.1.1.443 > 192.168.1.2.58498: Flags [S.], cksum 0x9f44 (correct), seq 3503056454, ack 19994193, win 65535, options [mss 1452,sackOK,TS val 2089229344 ecr 19994198,nop,wscale 13], length 0
14:26:40.636392 enp37s0 Out IP (tos 0x0, ttl 64, id 0, offset 0, flags [DF], proto TCP (6), length 40)
    192.168.1.2.58498 > 1.1.1.1.443: Flags [R], cksum 0xee74 (correct), seq 19994193, win 0, length 0
14:26:40.636531 enp37s0 Out IP (tos 0x0, ttl 64, id 50558, offset 0, flags [none], proto TCP (6), length 40)
    192.168.1.2.58498 > 1.1.1.1.443: Flags [.], cksum 0xb754 (correct), ack 3503056455, win 65535, length 0
14:26:40.646856 enp37s0 In  IP (tos 0x0, ttl 54, id 0, offset 0, flags [DF], proto TCP (6), length 40)
    1.1.1.1.443 > 192.168.1.2.58498: Flags [R], cksum 0xcee2 (correct), seq 3503056455, win 0, length 0
14:26:40.647413 enp37s0 Out IP (tos 0x0, ttl 64, id 50561, offset 0, flags [none], proto TCP (6), length 1500)
    192.168.1.2.58498 > 1.1.1.1.443: Flags [P.], cksum 0xc720 (correct), seq 19994193:19995653, ack 3503056455, win 65535, length 1460
14:26:40.658206 enp37s0 In  IP (tos 0x0, ttl 54, id 0, offset 0, flags [DF], proto TCP (6), length 40)
    1.1.1.1.443 > 192.168.1.2.58498: Flags [R], cksum 0xcee2 (correct), seq 3503056455, win 0, length 0
14:34:37.027721 enp37s0 Out IP (tos 0x0, ttl 64, id 24522, offset 0, flags [none], proto TCP (6), length 60)
    192.168.1.2.49986 > 1.1.1.1.443: Flags [S], cksum 0x006e (correct), seq 20470583, win 65535, options [mss 1460,sackOK,TS val 20470600 ecr 0,wscale 7,eol], length 0
14:34:37.039415 enp37s0 In  IP (tos 0x0, ttl 53, id 0, offset 0, flags [DF], proto TCP (6), length 60)
    1.1.1.1.443 > 192.168.1.2.49986: Flags [S.], cksum 0x013c (correct), seq 1211200360, ack 20470584, win 65535, options [mss 1452,sackOK,TS val 2619780443 ecr 20470600,nop,wscale 13], length 0
14:34:38.102433 enp37s0 In  IP (tos 0x0, ttl 53, id 0, offset 0, flags [DF], proto TCP (6), length 60)
    1.1.1.1.443 > 192.168.1.2.49986: Flags [S.], cksum 0xfd14 (correct), seq 1211200360, ack 20470584, win 65535, options [mss 1452,sackOK,TS val 2619781506 ecr 20470600,nop,wscale 13], length 0
14:56:03.076236 enp37s0 Out IP (tos 0x0, ttl 64, id 31985, offset 0, flags [none], proto TCP (6), length 60)
    192.168.1.2.52323 > 1.1.1.1.443: Flags [S], cksum 0xb7da (correct), seq 21756641, win 65535, options [mss 1460,sackOK,TS val 21756649 ecr 0,wscale 7,eol], length 0
14:56:03.087818 enp37s0 In  IP (tos 0x0, ttl 54, id 0, offset 0, flags [DF], proto TCP (6), length 60)
    1.1.1.1.443 > 192.168.1.2.52323: Flags [S.], cksum 0xf863 (correct), seq 2044855818, ack 21756642, win 65535, options [mss 1452,sackOK,TS val 532686260 ecr 21756649,nop,wscale 13], length 0
14:56:04.098997 enp37s0 In  IP (tos 0x0, ttl 54, id 0, offset 0, flags [DF], proto TCP (6), length 60)
    1.1.1.1.443 > 192.168.1.2.52323: Flags [S.], cksum 0xf46f (correct), seq 2044855818, ack 21756642, win 65535, options [mss 1452,sackOK,TS val 532687272 ecr 21756649,nop,wscale 13], length 0
15:03:03.760573 enp37s0 Out IP (tos 0x0, ttl 64, id 20063, offset 0, flags [none], proto TCP (6), length 60)
    192.168.1.2.63973 > 1.1.1.1.443: Flags [S], cksum 0xb3b3 (correct), seq 22177325, win 65535, options [mss 1460,sackOK,TS val 22177333 ecr 0,wscale 7,eol], length 0
15:03:03.773196 enp37s0 In  IP (tos 0x0, ttl 53, id 0, offset 0, flags [DF], proto TCP (6), length 60)
    1.1.1.1.443 > 192.168.1.2.63973: Flags [S.], cksum 0x26c5 (correct), seq 1344832229, ack 22177326, win 65535, options [mss 1452,sackOK,TS val 1010533263 ecr 22177333,nop,wscale 13], length 0
15:03:04.801929 enp37s0 In  IP (tos 0x0, ttl 53, id 0, offset 0, flags [DF], proto TCP (6), length 60)
    1.1.1.1.443 > 192.168.1.2.63973: Flags [S.], cksum 0x22c0 (correct), seq 1344832229, ack 22177326, win 65535, options [mss 1452,sackOK,TS val 1010534292 ecr 22177333,nop,wscale 13], length 0
15:20:01.550900 enp37s0 Out IP (tos 0x0, ttl 64, id 52740, offset 0, flags [none], proto TCP (6), length 60)
    192.168.1.2.49259 > 1.1.1.1.443: Flags [S], cksum 0xdd91 (correct), seq 23195115, win 65535, options [mss 1460,sackOK,TS val 23195124 ecr 0,wscale 7,eol], length 0
15:20:01.561887 enp37s0 In  IP (tos 0x0, ttl 54, id 0, offset 0, flags [DF], proto TCP (6), length 60)
    1.1.1.1.443 > 192.168.1.2.49259: Flags [S.], cksum 0x2b78 (correct), seq 3171871641, ack 23195116, win 65535, options [mss 1452,sackOK,TS val 3057604891 ecr 23195124,nop,wscale 13], length 0
15:20:02.608927 enp37s0 In  IP (tos 0x0, ttl 54, id 0, offset 0, flags [DF], proto TCP (6), length 60)
    1.1.1.1.443 > 192.168.1.2.49259: Flags [S.], cksum eq 3171871641, ack 23195116, win 65535, options [mss 1452,sackOK,TS val 3057604891 ecr 23195124,nop,wscale 13], length 0
15:20:02.608927 enp37s0 In  IP (tos 0x0, ttl 54, id 0, offset 0, flags [DF], proto TCP (6), length 60)
    1.1.1.1.443 > 192.168.1.2.49259: Flags [S.], cksum 0x2761 (correct), seq 3171871641, ack 23195116, win 65535, options [mss 1452,sackOK,TS val 3057605938 ecr 23195124,nop,wscale 13], length 0
15:21:59.284294 enp37s0 Out IP (tos 0x0, ttl 64, id 13083, offset 0, flags [none], proto TCP (6), length 60)
    192.168.1.2.62240 > 1.1.1.1.443: Flags [S], cksum 0x130e (correct), seq 23312849, win 65535, options [mss 1460,sackOK,TS val 23312857 ecr 0,wscale 7,eol], length 0
15:21:59.296828 enp37s0 In  IP (tos 0x0, ttl 53, id 0, offset 0, flags [DF], proto TCP (6), length 60)
    1.1.1.1.443 > 192.168.1.2.62240: Flags [S.], cksum 0x9bd6 (correct), seq 4060572786, ack 23312850, win 65535, options [mss 1452,sackOK,TS val 2809296692 ecr 23312857,nop,wscale 13], length 0
15:22:00.359906 enp37s0 In  IP (tos 0x0, ttl 53, id 0, offset 0, flags [DF], proto TCP (6), length 60)
    1.1.1.1.443 > 192.168.1.2.62240: Flags [S.], cksum 0x97af (correct), seq 4060572786, ack 23312850, win 65535, options [mss 1452,sackOK,TS val 2809297755 ecr 23312857,nop,wscale 13], length 0
15:38:18.874946 enp37s0 Out IP (tos 0x0, ttl 64, id 62739, offset 0, flags [none], proto TCP (6), length 60)
    192.168.1.2.61909 > 1.1.1.1.443: Flags [S], cksum 0x2f2d (correct), seq 24292440, win 65535, options [mss 1460,sackOK,TS val 24292448 ecr 0,wscale 7,eol], length 0
15:38:18.887461 enp37s0 In  IP (tos 0x0, ttl 54, id 0, offset 0, flags [DF], proto TCP (6), length 60)
    1.1.1.1.443 > 192.168.1.2.61909: Flags [S.], cksum 0xdb3e (correct), seq 3061921071, ack 24292441, win 65535, options [mss 1452,sackOK,TS val 100952099 ecr 24292448,nop,wscale 13], length 0
15:38:19.893369 enp37s0 In  IP (tos 0x0, ttl 54, id 0, offset 0, flags [DF], proto TCP (6), length 60)
    1.1.1.1.443 > 192.168.1.2.61909: Flags [S.], cksum 0xd750 (correct), seq 3061921071, ack 24292441, win 65535, options [mss 1452,sackOK,TS val 100953105 ecr 24292448,nop,wscale 13], length 0
17:03:44.073383 enp37s0 Out IP (tos 0x0, ttl 64, id 26508, offset 0, flags [none], proto TCP (6), length 60)
    192.168.1.2.65404 > 1.1.1.1.443: Flags [S], cksum 0xb855 (correct), seq 29417630, win 65535, options [mss 1460,sackOK,TS val 29417646 ecr 0,wscale 7,eol], length 0
17:03:44.086054 enp37s0 In  IP (tos 0x0, ttl 53, id 0, offset 0, flags [DF], proto TCP (6), length 60)
    1.1.1.1.443 > 192.168.1.2.65404: Flags [S.], cksum 0x541a (correct), seq 3048335213, ack 29417631, win 65535, options [mss 1452,sackOK,TS val 4078230000 ecr 29417646,nop,wscale 13], length 0
17:03:45.130330 enp37s0 In  IP (tos 0x0, ttl 53, id 0, offset 0, flags [DF], proto TCP (6), length 60)
    1.1.1.1.443 > 192.168.1.2.65404: Flags [S.], cksum 0x5005 (correct), seq 3048335213, ack 29417631, win 65535, options [mss 1452,sackOK,TS val 4078231045 ecr 29417646,nop,wscale 13], length 0
17:04:30.651695 enp37s0 Out IP (tos 0x0, ttl 64, id 53196, offset 0, flags [none], proto TCP (6), length 60)
    192.168.1.2.61895 > 1.1.1.1.443: Flags [S], cksum 0x5a24 (correct), seq 29464208, win 65535, options [mss 1460,sackOK,TS val 29464225 ecr 0,wscale 7,eol], length 0
17:04:30.662652 enp37s0 In  IP (tos 0x0, ttl 53, id 0, offset 0, flags [DF], proto TCP (6), length 60)
    1.1.1.1.443 > 192.168.1.2.61895: Flags [S.], cksum 0x0266 (correct), seq 2260244698, ack 29464209, win 65535, options [mss 1452,sackOK,TS val 2124332918 ecr 29464225,nop,wscale 13], length 0
17:04:31.692850 enp37s0 In  IP (tos 0x0, ttl 53, id 0, offset 0, flags [DF], proto TCP (6), length 60)
    1.1.1.1.443 > 192.168.1.2.61895: Flags [S.], cksum 0xfe5e (correct), seq 2260244698, ack 29464209, win 65535, options [mss 1452,sackOK,TS val 2124333949 ecr 29464225,nop,wscale 13], length 0
17:31:36.424075 enp37s0 Out IP (tos 0x0, ttl 64, id 65299, offset 0, flags [none], proto TCP (6), length 60)
    192.168.1.2.59716 > 1.1.1.1.443: Flags [S], cksum 0xc514 (correct), seq 318, ack 31089990, win 65535, options [mss 1452,sackOK,TS val 2519524580 ecr 31089997,nop,wscale 13], length 0
17:31:37.438248 enp37s0 In  IP (tos 0x0, ttl 53, id 0, offset 0, flags [DF], proto TCP (6), length 60)
    1.1.1.1.443 > 192.168.1.2.59716: Flags [S.], cksum 0x0240 (correct), seq 1088358628, ack 31089990, win 65535, options [mss 1452,sackOK,TS val 2519525582 ecr 31089997,nop,wscale 13], length 0
17:31:58.859587 enp37s0 Out IP (tos 0x0, ttl 64, id 21513, offset 0, flags [none], proto TCP (6), length 60)
    192.168.1.2.59786 > 1.1.1.1.443: Flags [S], cksum 0x1588 (correct), seq 31112424, win 65535, options [mss 1460,sackOK,TS val 31112432 ecr 0,wscale 7,eol], length 0
17:31:58.870104 enp37s0 In  IP (tos 0x0, ttl 54, id 0, offset 0, flags [DF], proto TCP (6), length 60)
    1.1.1.1.443 > 192.168.1.2.59786: Flags [S.], cksum 0xcce4 (correct), seq 1946853077, ack 31112425, win 65535, options [mss 1452,sackOK,TS val 31472077 ecr 31112432,nop,wscale 13], length 0
17:31:59.928548 enp37s0 In  IP (tos 0x0, ttl 54, id 0, offset 0, flags [DF], proto TCP (6), length 60)
    1.1.1.1.443 > 192.168.1.2.59786: Flags [S.], cksum 0xc8c1 (correct), seq 1946853077, ack 31112425, win 65535, options [mss 1452,sackOK,TS val 31473136 ecr 31112432,nop,wscale 13], length 0
17:32:15.329717 enp37s0 Out IP (tos 0x0, ttl 64, id 22529, offset 0, flags [none], proto TCP (6), length 60)
    192.168.1.2.55686 > 1.1.1.1.443: Flags [S], cksum 0xa4df (correct), seq 31128894, win 65535, options [mss 1460,sackOK,TS val 31128902 ecr 0,wscale 7,eol], length 0
17:32:15.341641 enp37s0 In  IP (tos 0x0, ttl 54, id 0, offset 0, flags [DF], proto TCP (6), length 60)
    1.1.1.1.443 > 192.168.1.2.55686: Flags [S.], cksum 0x7971 (correct), seq 865811623, ack 31128895, win 65535, options [mss 1452,sackOK,TS val 915966589 ecr 31128902,nop,wscale 13], length 0
17:32:16.403514 enp37s0 In  IP (tos 0x0, ttl 54, id 0, offset 0, flags [DF], proto TCP (6), length 60)
    1.1.1.1.443 > 192.168.1.2.55686: Flags [S.], cksum 0x754b (correct), seq 865811623, ack 31128895, win 65535, options [mss 1452,sackOK,TS val 915967651 ecr 31128902,nop,wscale 13], length 0
17:32:47.480002 enp37s0 Out IP (tos 0x0, ttl 64, id 27912, offset 0, flags [none], proto TCP (6), length 60)
    192.168.1.2.64001 > 1.1.1.1.443: Flags [S], cksum 0x8936 (correct), seq 31161044, win 65535, options [mss 1460,sackOK,TS val 31161053 ecr 0,wscale 7,eol], length 0
17:32:47.489280 enp37s0 In  IP (tos 0x0, ttl 54, id 0, offset 0, flags [DF], proto TCP (6), length 60)
    1.1.1.1.443 > 192.168.1.2.64001: Flags [S.], cksum 0xf151 (correct), seq 3124891282, ack 31161045, win 65535, options [mss 1452,sackOK,TS val 1019516981 ecr 31161053,nop,wscale 13], length 0
17:32:48.543841 enp37s0 In  IP (tos 0x0, ttl 54, id 0, offset 0, flags [DF], proto TCP (6), length 60)
    1.1.1.1.443 > 192.168.1.2.64001: Flags [S.], cksum 0xed32 (correct), seq 3124891282, ack 31161045, win 65535, options [mss 1452,sackOK,TS val 1019518036 ecr 31161053,nop,wscale 13], length 0
17:33:12.339869 enp37s0 Out IP (tos 0x0, ttl 64, id 40133, offset 0, flags [none], proto TCP (6), length 60)
    192.168.1.2.53326 > 1.1.1.1.443: Flags [S], cksum 0xf0ce (correct), seq 31185877, win 65535, options [mss 1460,sackOK,TS val 31185910 ecr 0,wscale 7,eol], length 0
17:33:12.350594 enp37s0 In  IP (tos 0x0, ttl 53, id 0, offset 0, flags [DF], proto TCP (6), length 60)
    1.1.1.1.443 > 192.168.1.2.53326: Flags [S.], cksum 0x0436 (correct), seq 110775988, ack 31185878, win 65535, options [mss 1452,sackOK,TS val 2186615519 ecr 31185910,nop,wscale 13], length 0
17:33:13.370726 enp37s0 In  IP (tos 0x0, ttl 53, id 0, offset 0, flags [DF], proto TCP (6), length 60)
    1.1.1.1.443 > 192.168.1.2.53326: Flags [S.], cksum 0x0039 (correct), seq 110775988, ack 31185878, win 65535, options [mss 1452,sackOK,TS val 2186616540 ecr 31185910,nop,wscale 13], length 0
17:33:35.276951 enp37s0 Out IP (tos 0x0, ttl 64, id 59756, offset 0, flags [none], proto TCP (6), length 60)
    192.168.1.2.62159 > 1.1.1.1.443: Flags [S], cksum 0x1b0d (correct), seq 31208827, win 65535, options [mss 1460,sackOK,TS val 31208848 ecr 0,wscale 7,eol], length 0
17:33:35.287749 enp37s0 In  IP (tos 0x0, ttl 54, id 0, offset 0, flags [DF], proto TCP (6), length 60)
    1.1.1.1.443 > 192.168.1.2.62159: Flags [S.], cksum 0x2f1d (correct), seq 1701309066, ack 31208828, win 65535, options [mss 1452,sackOK,TS val 688421087 ecr 31208848,nop,wscale 13], length 0
17:33:36.322144 enp37s0 In  IP (tos 0x0, ttl 54, id 0, offset 0, flags [DF], proto TCP (6), length 60)
    1.1.1.1.443 > 192.168.1.2.62159: Flags [S.], cksum 0x2b12 (correct), seq 1701309066, ack 31208828, win 65535, options [mss 1452,sackOK,TS val 688422122 ecr 31208848,nop,wscale 13], length 0
17:35:45.945378 enp37s0 Out IP (tos 0x0, ttl 64, id 62746, offset 0, flags [none], proto TCP (6), length 60)
    192.168.1.2.58093 > 1.1.1.1.443: Flags [S], cksum 0x2e06 (correct), seq 31339506, win 65535, options [mss 1460,sackOK,TS val 31339518 ecr 0,wscale 7,eol], length 0
17:35:45.956824 enp37s0 In  IP (tos 0x0, ttl 53, id 0, offset 0, flags [DF], proto TCP (6), length 60)
    1.1.1.1.443 > 192.168.1.2.58093: Flags [S.], cksum 0xdded (correct), seq 1301812011, ack 31339507, win 65535, options [mss 1452,sackOK,TS val 2186769127 ecr 31339518,nop,wscale 13], length 0
17:35:46.970374 enp37s0 In  IP (tos 0x0, ttl 53, id 0, offset 0, flags [DF], proto TCP (6), length 60)
    1.1.1.1.443 > 192.168.1.2.58093: Flags [S.], cksum 0xd9f7 (correct), seq 1301812011, ack 31339507, win 65535, options [mss 1452,sackOK,TS val 2186770141 ecr 31339518,nop,wscale 13], length 0
17:36:53.591109 enp37s0 Out IP (tos 0x0, ttl 64, id 59300, offset 0, flags [none], proto TCP (6), length 60)
    192.168.1.2.58052 > 1.1.1.1.443: Flags [S], cksum 0x1daf (correct), seq 31407154, win 65535, options [mss 1460,sackOK,TS val 31407164 ecr 0,wscale 7,eol], length 0
17:36:53.601948 enp37s0 In  IP (tos 0x0, ttl 53, id 0, offset 0, flags [DF], proto TCP (6), length 60)
    1.1.1.1.443 > 192.168.1.2.58052: Flags [S.], cksum 0x3717 (correct), seq 1190129113, ack 31407155, win 65535, options [mss 1452,sackOK,TS val 2368481932 ecr 31407164,nop,wscale 13], length 0
17:36:54.645730 enp37s0 In  IP (tos 0x0, ttl 53, id 0, offset 0, flags [DF], proto TCP (6), length 60)
    1.1.1.1.443 > 192.168.1.2.58052: Flags [S.], cksum 0x3303 (correct), seq 1190129113, ack 31407155, win 65535, options [mss 1452,sackOK,TS val 2368482976 ecr 31407164,nop,wscale 13], length 0
18:03:14.161316 enp37s0 Out IP (tos 0x0, ttl 64, id 63298, offset 0, flags [none], proto TCP (6), length 60)
    192.168.1.2.49964 > 1.1.1.1.443: Flags [S], cksum 0x00e3 (correct), seq 32987724, win 65535, options [mss 1460,sackOK,TS val 32987734 ecr 0,wscale 7,eol], length 0
18:03:14.172199 enp37s0 In  IP (tos 0x0, ttl 53, id 0, offset 0, flags [DF], proto TCP (6), length 60)
    1.1.1.1.443 > 192.168.1.2.49964: Flags [S.], cksum 0x377e (correct), seq 3628695032, ack 32987725, win 65535, options [mss 1452,sackOK,TS val 3862205143 ecr 32987734,nop,wscale 13], length 0
18:03:15.172366 enp37s0 In  IP (tos 0x0, ttl 53, id 0, offset 0, flags [DF], proto TCP (6), length 60)
    1.1.1.1.443 > 192.168.1.2.49964: Flags [S.], cksum 0x3395 (correct), seq 3628695032, ack 32987725, win 65535, options [mss 1452,sackOK,TS val 3862206144 ecr 32987734,nop,wscale 13], length 0
18:03:53.790372 enp37s0 Out IP (tos 0x0, ttl 64, id 11837, offset 0, flags [none], proto TCP (6), length 60)
    192.168.1.2.54201 > 1.1.1.1.443: Flags [S], cksum 0xbab8 (correct), seq 33027355, win 65535, options [mss 1460,sackOK,TS val 33027363 ecr 0,wscale 7,eol], length 0
18:03:53.802486 enp37s0 In  IP (tos 0x0, ttl 53, id 0, offset 0, flags [DF], proto TCP (6), length 60)
    1.1.1.1.443 > 192.168.1.2.54201: Flags [S.], cksum 0xd4b8 (correct), seq 358689555, ack 33027356, win 65535, options [mss 1452,sackOK,TS val 851998893 ecr 33027363,nop,wscale 13], length 0
18:03:54.861100 enp37s0 In  IP (tos 0x0, ttl 53, id 0, offset 0, flags [DF], proto TCP (6), length 60)
    1.1.1.1.443 > 192.168.1.2.54201: Flags [S.], cksum 0xd095 (correct), seq 358689555, ack 33027356, win 65535, options [mss 1452,sackOK,TS val 851999952 ecr 33027363,nop,wscale 13], length 0
18:04:30.919931 enp37s0 Out IP (tos 0x0, ttl 64, id 18741, offset 0, flags [none], proto TCP (6), length 60)
    192.168.1.2.62708 > 1.1.1.1.443: Flags [S], cksum 0x7769 (correct), seq 33064484, win 65535, options [mss 1460,sackOK,TS val 33064493 ecr 0,wscale 7,eol], length 0
18:04:30.933133 enp37s0 In  IP (tos 0x0, ttl 53, id 0, offset 0, flags [DF], proto TCP (6), length 60)
    1.1.1.1.443 > 192.168.1.2.62708: Flags [S.], cksum 0x5d2c (correct), seq 3011563670, ack 33064485, win 65535, options [mss 1452,sackOK,TS val 2521499076 ecr 33064493,nop,wscale 13], length 0
18:04:31.966629 enp37s0 In  IP (tos 0x0, ttl 53, id 0, offset 0, flags [DF], proto TCP (6), length 60)
    1.1.1.1.443 > 192.168.1.2.62708: Flags [S.], cksum 0x5922 (correct), seq 3011563670, ack 33064485, win 65535, options [mss 1452,sackOK,TS val 2521500110 ecr 33064493,nop,wscale 13], length 0
18:04:45.256248 enp37s0 Out IP (tos 0x0, ttl 64, id 24697, offset 0, flags [none], proto TCP (6), length 60)
    192.168.1.2.63842 > 1.1.1.1.443: Flags [S], cksum 0x02fa (correct), seq 33078821, win 65535, options [mss 1460,sackOK,TS val 33078829 ecr 0,wscale 7,eol], length 0
18:04:45.266581 enp37s0 In  IP (tos 0x0, ttl 54, id 0, offset 0, flags [DF], proto TCP (6), length 60)
    1.1.1.1.443 > 192.168.1.2.63842: Flags [S.], cksum 0x8fbb (correct), seq 1234819449, ack 33078822, win 65535, options [mss 1452,sackOK,TS val 3388247072 ecr 33078829,nop,wscale 13], length 0
18:04:46.267202 enp37s0 In  IP (tos 0x0, ttl 54, id 0, offset 0, flags [DF], proto TCP (6), length 60)
    1.1.1.1.443 > 192.168.1.2.63842: Flags [S.], cksum 0x8bd2 (correct), seq 1234819449, ack 33078822, win 65535, options [mss 1452,sackOK,TS val 3388248073 ecr 33078829,nop,wscale 13], length 0
18:07:09.251144 enp37s0 Out IP (tos 0x0, ttl 64, id 55932, offset 0, flags [none], proto TCP (6), length 60)
    192.168.1.2.55927 > 1.1.1.1.443: Flags [S], cksum 0xbcfd (correct), seq 33222799, win 65535, options [mss 1460,sackOK,TS val 33222822 ecr 0,wscale 7,eol], length 0
18:07:09.262952 enp37s0 In  IP (tos 0x0, ttl 53, id 0, offset 0, flags [DF], proto TCP (6), length 60)
    1.1.1.1.443 > 192.168.1.2.55927: Flags [S.], cksum 0xf4f6 (correct), seq 1776605545, ack 33222800, win 65535, options [mss 1452,sackOK,TS val 3841369515 ecr 33222822,nop,wscale 13], length 0
18:07:10.286059 enp37s0 In  IP (tos 0x0, ttl 53, id 0, offset 0, flags [DF], proto TCP (6), length 60)
    1.1.1.1.443 > 192.168.1.2.55927: Flags [S.], cksum 0xf0f6 (correct), seq 1776605545, ack 33222800, win 65535, options [mss 1452,sackOK,TS val 3841370539 ecr 33222822,nop,wscale 13], length 0
18:07:55.533228 enp37s0 Out IP (tos 0x0, ttl 64, id 79, offset 0, flags [none], proto TCP (6), length 60)
    192.168.1.2.50581 > 1.1.1.1.443: Flags [S], cksum 0x6838 (correct), seq 33269097, win 65535, options [mss 1460,sackOK,TS val 33269106 ecr 0,wscale 7,eol], length 0
18:07:55.546378 enp37s0 In  IP (tos 0x0, ttl 53, id 0, offset 0, flags [DF], proto TCP (6), length 60)
    1.1.1.1.443 > 192.168.1.2.50581: Flags [S.], cksum 0x0647 (correct), seq 1964267725, ack 33269098, win 65535, options [mss 1452,sackOK,TS val 3140411082 ecr 33269106,nop,wscale 13], length 0
18:07:55.636812 enp37s0 Out IP (tos 0x0, ttl 64, id 153, offset 0, flags [none], proto TCP (6), length 60)
    192.168.1.2.51000 > 1.1.1.1.443: Flags [S], cksum 0x65c6 (correct), seq 33269201, win 65535, options [mss 1460,sackOK,TS val 33269209 ecr 0,wscale 7,eol], length 0
18:07:55.647085 enp37s0 In  IP (tos 0x0, ttl 54, id 0, offset 0, flags [DF], proto TCP (6), length 60)
    1.1.1.1.443 > 192.168.1.2.51000: Flags [S.], cksum 0x7619 (correct), seq 807975472, ack 33269202, win 65535, options [mss 1452,sackOK,TS val 2819253043 ecr 33269209,nop,wscale 13], length 0
18:07:56.554543 enp37s0 In  IP (tos 0x0, ttl 53, id 0, offset 0, flags [DF], proto TCP (6), length 60)
    1.1.1.1.443 > 192.168.1.2.50581: Flags [S.], cksum 0x0256 (correct), seq 1964267725, ack 33269098, win 65535, options [mss 1452,sackOK,TS val 3140412091 ecr 33269106,nop,wscale 13], length 0
18:07:56.710923 enp37s0 In  IP (tos 0x0, ttl 54, id 0, offset 0, flags [DF], proto TCP (6), length 60)
    1.1.1.1.443 > 192.168.1.2.51000: Flags [S.], cksum 0x71f1 (correct), seq 807975472, ack 33269202, win 65535, options [mss 1452,sackOK,TS val 2819254107 ecr 33269209,nop,wscale 13], length 0
18:12:12.781909 enp37s0 Out IP (tos 0x0, ttl 64, id 34223, offset 0, flags [none], proto TCP (6), length 60)
    192.168.1.2.61256 > 1.1.1.1.443: Flags [S], cksum 0x64bc (correct), seq 33526346, win 65535, options [mss 1460,sackOK,TS val 33526354 ecr 0,wscale 7,eol], length 0
18:12:12.791201 enp37s0 In  IP (tos 0x0, ttl 54, id 0, offset 0, flags [DF], proto TCP (6), length 60)
    1.1.1.1.443 > 192.168.1.2.61256: Flags [S.], cksum 0xee39 (correct), seq 29124790, ack 33526347, win 65535, options [mss 1452,sackOK,TS val 148113702 ecr 33526354,nop,wscale 13], length 0
18:12:13.809108 enp37s0 In  IP (tos 0x0, ttl 54, id 0, offset 0, flags [DF], proto TCP (6), length 60)
    1.1.1.1.443 > 192.168.1.2.61256: Flags [S.], cksum 0xea3f (correct), seq 29124790, ack 33526347, win 65535, options [mss 1452,sackOK,TS val 148114720 ecr 33526354,nop,wscale 13], length 0
18:12:26.367760 enp37s0 Out IP (tos 0x0, ttl 64, id 43117, offset 0, flags [none], proto TCP (6), length 60)
    192.168.1.2.61296 > 1.1.1.1.443: Flags [S], cksum 0xfa6f (correct), seq 33539932, win 65535, options [mss 1460,sackOK,TS val 33539940 ecr 0,wscale 7,eol], length 0
18:12:26.380272 enp37s0 In  IP (tos 0x0, ttl 54, id 0, offset 0, flags [DF], proto TCP (6), length 60)
    1.1.1.1.443 > 192.168.1.2.61296: Flags [S.], cksum 0x639a (correct), seq 1282986632, ack 33539933, win 65535, options [mss 1452,sackOK,TS val 852511470 ecr 33539940,nop,wscale 13], length 0
18:12:27.437358 enp37s0 In  IP (tos 0x0, ttl 54, id 0, offset 0, flags [DF], proto TCP (6), length 60)
    1.1.1.1.443 > 192.168.1.2.61296: Flags [S.], cksum 0x5f78 (correct), seq 1282986632, ack 33539933, win 65535, options [mss 1452,sackOK,TS val 852512528 ecr 33539940,nop,wscale 13], length 0
18:34:34.141487 enp37s0 Out IP (tos 0x0, ttl 64, id 56421, offset 0, flags [none], proto TCP (6), length 60)
    192.168.1.2.65101 > 1.1.1.1.443: Flags [S], cksum 0x6633 (correct), seq 34867701, win 65535, options [mss 1460,sackOK,TS val 34867714 ecr 0,wscale 7,eol], length 0
18:34:34.153824 enp37s0 In  IP (tos 0x0, ttl 54, id 0, offset 0, flags [DF], proto TCP (6), length 60)
    1.1.1.1.443 > 192.168.1.2.65101: Flags [S.], cksum 0xcee4 (correct), seq 875552586, ack 34867702, win 65535, options [mss 1452,sackOK,TS val 149455062 ecr 34867714,nop,wscale 13], length 0
18:34:35.187004 enp37s0 In  IP (tos 0x0, ttl 54, id 0, offset 0, flags [DF], proto TCP (6), length 60)
    1.1.1.1.443 > 192.168.1.2.65101: Flags [S.], cksum 0xcada (correct), seq 875552586, ack 34867702, win 65535, options [mss 1452,sackOK,TS val 149456096 ecr 34867714,nop,wscale 13], length 0
18:34:53.596358 enp37s0 Out IP (tos 0x0, ttl 64, id 56912, offset 0, flags [none], proto TCP (6), length 60)
    192.168.1.2.56624 > 1.1.1.1.443: Flags [S], cksum 0xef5b (correct), seq 34887148, win 65535, options [mss 1460,sackOK,TS val 34887167 ecr 0,wscale 7,eol], length 0
18:34:53.608385 enp37s0 In  IP (tos 0x0, ttl 54, id 0, offset 0, flags [DF], proto TCP (6), length 60)
    1.1.1.1.443 > 192.168.1.2.56624: Flags [S.], cksum 0x523f (correct), seq 2900305785, ack 34887149, win 65535, options [mss 1452,sackOK,TS val 2328576994 ecr 34887167,nop,wscale 13], length 0
18:34:54.640992 enp37s0 In  IP (tos 0x0, ttl 54, id 0, offset 0, flags [DF], proto TCP (6), length 60)
    1.1.1.1.443 > 192.168.1.2.56624: Flags [S.], cksum 0x4e36 (correct), seq 2900305785, ack 34887149, win 65535, options [mss 1452,sackOK,TS val 2328578027 ecr 34887167,nop,wscale 13], length 0
18:36:33.820744 enp37s0 Out IP (tos 0x0, ttl 64, id 10974, offset 0, flags [none], proto TCP (6), length 60)
    192.168.1.2.53479 > 1.1.1.1.443: Flags [S], cksum 0xec92 (correct), seq 34987385, win 65535, options [mss 1460,sackOK,TS val 34987393 ecr 0,wscale 7,eol], length 0
18:36:33.830480 enp37s0 In  IP (tos 0x0, ttl 53, id 0, offset 0, flags [DF], proto TCP (6), length 60)
    1.1.1.1.443 > 192.168.1.2.53479: Flags [S.], cksum 0x1296 (correct), seq 3359764371, ack 34987386, win 65535, options [mss 1452,sackOK,TS val 1608173622 ecr 34987393,nop,wscale 13], length 0
18:36:34.871359 enp37s0 In  IP (tos 0x0, ttl 53, id 0, offset 0, flags [DF], proto TCP (6), length 60)
    1.1.1.1.443 > 192.168.1.2.53479: Flags [S.], cksum 0x0e84 (correct), seq 3359764371, ack 34987386, win 65535, options [mss 1452,sackOK,TS val 1608174664 ecr 34987393,nop,wscale 13], length 0
18:36:57.856179 enp37s0 Out IP (tos 0x0, ttl 64, id 21260, offset 0, flags [none], proto TCP (6), length 60)
    192.168.1.2.61588 > 1.1.1.1.443: Flags [S], cksum 0x111d (correct), seq 35011421, win 65535, options [mss 1460,sackOK,TS val 35011429 ecr 0,wscale 7,eol], length 0
18:36:57.865966 enp37s0 In  IP (tos 0x0, ttl 53, id 0, offset 0, flags [DF], proto TCP (6), length 60)
    1.1.1.1.443 > 192.168.1.2.61588: Flags [S.], cksum 0x0516 (correct), seq 310509985, ack 35011422, win 65535, options [mss 1452,sackOK,TS val 111671078 ecr 35011429,nop,wscale 13], length 0
18:36:58.868256 enp37s0 In  IP (tos 0x0, ttl 53, id 0, offset 0, flags [DF], proto TCP (6), length 60)
    1.1.1.1.443 > 192.168.1.2.61588: Flags [S.], cksum 0x012b (correct), seq 310509985, ack 35011422, win 65535, options [mss 1452,sackOK,TS val 111672081 ecr 35011429,nop,wscale 13], length 0
18:47:30.020547 enp37s0 Out IP (tos 0x0, ttl 64, id 50731, offset 0, flags [none], proto TCP (6), length 60)
    192.168.1.2.49991 > 1.1.1.1.443: Flags [S], cksum 0xf38e (correct), seq 35643585, win 65535, options [mss 1460,sackOK,TS val 35643593 ecr 0,wscale 7,eol], length 0
18:47:30.031386 enp37s0 In  IP (tos 0x0, ttl 54, id 0, offset 0, flags [DF], proto TCP (6), length 60)
    1.1.1.1.443 > 192.168.1.2.49991: Flags [S.], cksum 0xe7eb (correct), seq 349281520, ack 35643586, win 65535, options [mss 1452,sackOK,TS val 36003238 ecr 35643593,nop,wscale 13], length 0
18:47:31.065241 enp37s0 In  IP (tos 0x0, ttl 54, id 0, offset 0, flags [DF], proto TCP (6), length 60)
    1.1.1.1.443 > 192.168.1.2.49991: Flags [S.], cksum 0xe3e1 (correct), seq 349281520, ack 35643586, win 65535, options [mss 1452,sackOK,TS val 36004272 ecr 35643593,nop,wscale 13], length 0
18:47:41.709398 enp37s0 Out IP (tos 0x0, ttl 64, id 58549, offset 0, flags [none], proto TCP (6), length 60)
    192.168.1.2.54698 > 1.1.1.1.443: Flags [S], cksum 0x85da (correct), seq 35655273, win 65535, options [mss 1460,sackOK,TS val 35655282 ecr 0,wscale 7,eol], length 0
18:47:41.721291 enp37s0 In  IP (tos 0x0, ttl 53, id 0, offset 0, flags [DF], proto TCP (6), length 60)
    1.1.1.1.443 > 192.168.1.2.54698: Flags [S.], cksum 0x5ff8 (correct), seq 961929197, ack 35655274, win 65535, options [mss 1452,sackOK,TS val 2485419620 ecr 35655282,nop,wscale 13], length 0
18:47:42.753156 enp37s0 In  IP (tos 0x0, ttl 53, id 0, offset 0, flags [DF], proto TCP (6), length 60)
    1.1.1.1.443 > 192.168.1.2.54698: Flags [S.], cksum 0x5bf0 (correct), seq 961929197, ack 35655274, win 65535, options [mss 1452,sackOK,TS val 2485420652 ecr 35655282,nop,wscale 13], length 0
18:47:56.015904 enp37s0 Out IP (tos 0x0, ttl 64, id 4827, offset 0, flags [none], proto TCP (6), length 60)
    192.168.1.2.50490 > 1.1.1.1.443: Flags [S], cksum 0x2692 (correct), seq 35669568, win 65535, options [mss 1460,sackOK,TS val 35669587 ecr 0,wscale 7,eol], length 0
18:47:56.025884 enp37s0 In  IP (tos 0x0, ttl 53, id 0, offset 0, flags [DF], proto TCP (6), length 60)
    1.1.1.1.443 > 192.168.1.2.50490: Flags [S.], cksum 0xadbc (correct), seq 2547233141, ack 35669569, win 65535, options [mss 1452,sackOK,TS val 2634979431 ecr 35669587,nop,wscale 13], length 0
18:47:57.077725 enp37s0 In  IP (tos 0x0, ttl 53, id 0, offset 0, flags [DF], proto TCP (6), length 60)
    1.1.1.1.443 > 192.168.1.2.50490: Flags [S.], cksum 0xa9a0 (correct), seq 2547233141, ack 35669569, win 65535, options [mss 1452,sackOK,TS val 2634980483 ecr 35669587,nop,wscale 13], length 0
18:48:18.627307 enp37s0 Out IP (tos 0x0, ttl 64, id 11076, offset 0, flags [none], proto TCP (6), length 60)
    192.168.1.2.55990 > 1.1.1.1.443: Flags [S], cksum 0x6060 (correct), seq 35692192, win 65535, options [mss 1460,sackOK,TS val 35692200 ecr 0,wscale 7,eol], length 0
18:48:18.639779 enp37s0 In  IP (tos 0x0, ttl 53, id 0, offset 0, flags [DF], proto TCP (6), length 60)
    1.1.1.1.443 > 192.168.1.2.55990: Flags [S.], cksum 0x57c2 (correct), seq 2640864733, ack 35692193, win 65535, options [mss 1452,sackOK,TS val 692904437 ecr 35692200,nop,wscale 13], length 0
18:48:19.652658 enp37s0 In  IP (tos 0x0, ttl 53, id 0, offset 0, flags [DF], proto TCP (6), length 60)
    1.1.1.1.443 > 192.168.1.2.55990: Flags [S.], cksum 0x53cd (correct), seq 2640864733, ack 35692193, win 65535, options [mss 1452,sackOK,TS val 692905450 ecr 35692200,nop,wscale 13], length 0
20:35:37.094315 enp37s0 Out IP (tos 0x0, ttl 64, id 19312, offset 0, flags [none], proto TCP (6), length 60)
    192.168.1.2.49990 > 1.1.1.1.443: Flags [S], cksum 0xfa8b (correct), seq 42130653, win 65535, options [mss 1460,sackOK,TS val 42130667 ecr 0,wscale 7,eol], length 0
20:35:37.106394 enp37s0 In  IP (tos 0x0, ttl 53, id 0, offset 0, flags [DF], proto TCP (6), length 60)
    1.1.1.1.443 > 192.168.1.2.49990: Flags [S.], cksum 0x7e31 (correct), seq 1427237591, ack 42130654, win 65535, options [mss 1452,sackOK,TS val 4031861257 ecr 42130667,nop,wscale 13], length 0
20:35:38.127693 enp37s0 In  IP (tos 0x0, ttl 53, id 0, offset 0, flags [DF], proto TCP (6), length 60)
    1.1.1.1.443 > 192.168.1.2.49990: Flags [S.], cksum 0x7a33 (correct), seq 1427237591, ack 42130654, win 65535, options [mss 1452,sackOK,TS val 4031862279 ecr 42130667,nop,wscale 13], length 0
20:35:50.636349 enp37s0 Out IP (tos 0x0, ttl 64, id 21314, offset 0, flags [none], proto TCP (6), length 60)
    192.168.1.2.54970 > 1.1.1.1.443: Flags [S], cksum 0x7d55 (correct), seq 42144187, win 65535, options [mss 1460,sackOK,TS val 42144207 ecr 0,wscale 7,eol], length 0
20:35:50.648525 enp37s0 In  IP (tos 0x0, ttl 54, id 0, offset 0, flags [DF], proto TCP (6), length 60)
    1.1.1.1.443 > 192.168.1.2.54970: Flags [S.], cksum 0x2c8b (correct), seq 2418587222, ack 42144188, win 65535, options [mss 1452,sackOK,TS val 3216265344 ecr 42144207,nop,wscale 13], length 0
20:35:51.684825 enp37s0 In  IP (tos 0x0, ttl 54, id 0, offset 0, flags [DF], proto TCP (6), length 60)
    1.1.1.1.443 > 192.168.1.2.54970: Flags [S.], cksum 0x287e (correct), seq 2418587222, ack 42144188, win 65535, options [mss 1452,sackOK,TS val 3216266381 ecr 42144207,nop,wscale 13], length 0
20:36:00.035397 enp37s0 Out IP (tos 0x0, ttl 64, id 25738, offset 0, flags [none], proto TCP (6), length 60)
    192.168.1.2.51814 > 1.1.1.1.443: Flags [S], cksum 0x402b (correct), seq 42153600, win 65535, options [mss 1460,sackOK,TS val 42153608 ecr 0,wscale 7,eol], length 0
20:36:00.047683 enp37s0 In  IP (tos 0x0, ttl 54, id 0, offset 0, flags [DF], proto TCP (6), length 60)
    1.1.1.1.443 > 192.168.1.2.51814: Flags [S.], cksum 0xe752 (correct), seq 4045979125, ack 42153601, win 65535, options [mss 1452,sackOK,TS val 2335843433 ecr 42153608,nop,wscale 13], length 0
20:36:01.072143 enp37s0 In  IP (tos 0x0, ttl 54, id 0, offset 0, flags [DF], proto TCP (6), length 60)
    1.1.1.1.443 > 192.168.1.2.51814: Flags [S.], cksum 0xe351 (correct), seq 4045979125, ack 42153601, win 65535, options [mss 1452,sackOK,TS val 2335844458 ecr 42153608,nop,wscale 13], length 0
20:40:19.075937 enp37s0 Out IP (tos 0x0, ttl 64, id 52342, offset 0, flags [none], proto TCP (6), length 60)
    192.168.1.2.58280 > 1.1.1.1.443: Flags [S], cksum 0x3f20 (correct), seq 42412640, win 65535, options [mss 1460,sackOK,TS val 42412649 ecr 0,wscale 7,eol], length 0
20:40:19.088088 enp37s0 In  IP (tos 0x0, ttl 54, id 0, offset 0, flags [DF], proto TCP (6), length 60)
    1.1.1.1.443 > 192.168.1.2.58280: Flags [S.], cksum 0xa706 (correct), seq 1585664156, ack 42412641, win 65535, options [mss 1452,sackOK,TS val 927250335 ecr 42412649,nop,wscale 13], length 0
20:40:20.114952 enp37s0 In  IP (tos 0x0, ttl 54, id 0, offset 0, flags [DF], proto TCP (6), length 60)
    1.1.1.1.443 > 192.168.1.2.58280: Flags [S.], cksum 0xa303 (correct), seq 1585664156, ack 42412641, win 65535, options [mss 1452,sackOK,TS val 927251362 ecr 42412649,nop,wscale 13], length 0
20:40:30.576642 enp37s0 Out IP (tos 0x0, ttl 64, id 62600, offset 0, flags [none], proto TCP (6), length 60)
    192.168.1.2.62687 > 1.1.1.1.443: Flags [S], cksum 0xd41f (correct), seq 42424127, win 65535, options [mss 1460,sackOK,TS val 42424147 ecr 0,wscale 7,eol], length 0
20:40:30.588902 enp37s0 In  IP (tos 0x0, ttl 54, id 0, offset 0, flags [DF], proto TCP (6), length 60)
    1.1.1.1.443 > 192.168.1.2.62687: Flags [S.], cksum 0xcb17 (correct), seq 168280183, ack 42424128, win 65535, options [mss 1452,sackOK,TS val 4091236503 ecr 42424147,nop,wscale 13], length 0
20:40:31.594123 enp37s0 In  IP (tos 0x0, ttl 54, id 0, offset 0, flags [DF], proto TCP (6), length 60)
    1.1.1.1.443 > 192.168.1.2.62687: Flags [S.], cksum 0xc729 (correct), seq 168280183, ack 42424128, win 65535, options [mss 1452,sackOK,TS val 4091237509 ecr 42424147,nop,wscale 13], length 0
20:40:41.260464 enp37s0 Out IP (tos 0x0, ttl 64, id 65359, offset 0, flags [none], proto TCP (6), length 60)
    192.168.1.2.60699 > 1.1.1.1.443: Flags [S], cksum 0x885b (correct), seq 42434825, win 65535, options [mss 1460,sackOK,TS val 42434833 ecr 0,wscale 7,eol], length 0
20:40:41.272189 enp37s0 In  IP (tos 0x0, ttl 53, id 0, offset 0, flags [DF], proto TCP (6), length 60)
    1.1.1.1.443 > 192.168.1.2.60699: Flags [S.], cksum 0x38c5 (correct), seq 2262157809, ack 42434826, win 65535, options [mss 1452,sackOK,TS val 2111669979 ecr 42434833,nop,wscale 13], length 0
20:40:42.286114 enp37s0 In  IP (tos 0x0, ttl 53, id 0, offset 0, flags [DF], proto TCP (6), length 60)
    1.1.1.1.443 > 192.168.1.2.60699: Flags [S.], cksum 0x34cf (correct), seq 2262157809, ack 42434826, win 65535, options [mss 1452,sackOK,TS val 2111670993 ecr 42434833,nop,wscale 13], length 0
20:44:59.838724 enp37s0 Out IP (tos 0x0, ttl 64, id 1490, offset 0, flags [none], proto TCP (6), length 60)
    192.168.1.2.61745 > 1.1.1.1.443: Flags [S], cksum 0xa02a (correct), seq 42693388, win 65535, options [mss 1460,sackOK,TS val 42693409 ecr 0,wscale 7,eol], length 0
20:44:59.851828 enp37s0 In  IP (tos 0x0, ttl 53, id 0, offset 0, flags [DF], proto TCP (6), length 60)
    1.1.1.1.443 > 192.168.1.2.61745: Flags [S.], cksum 0x8d0a (correct), seq 1570552881, ack 42693389, win 65535, options [mss 1452,sackOK,TS val 736351064 ecr 42693409,nop,wscale 13], length 0
20:45:00.866055 enp37s0 In  IP (tos 0x0, ttl 53, id 0, offset 0, flags [DF], proto TCP (6), length 60)
    1.1.1.1.443 > 192.168.1.2.61745: Flags [S.], cksum 0x8913 (correct), seq 1570552881, ack 42693389, win 65535, options [mss 1452,sackOK,TS val 736352079 ecr 42693409,nop,wscale 13], length 0
20:45:24.590694 enp37s0 Out IP (tos 0x0, ttl 64, id 17461, offset 0, flags [none], proto TCP (6), length 60)
    192.168.1.2.62893 > 1.1.1.1.443: Flags [S], cksum 0xda4b (correct), seq 42718142, win 65535, options [mss 1460,sackOK,TS val 42718161 ecr 0,wscale 7,eol], length 0
20:45:24.601625 enp37s0 In  IP (tos 0x0, ttl 54, id 0, offset 0, flags [DF], proto TCP (6), length 60)
    1.1.1.1.443 > 192.168.1.2.62893: Flags [S.], cksum 0x49d3 (correct), seq 2995704351, ack 42718143, win 65535, options [mss 1452,sackOK,TS val 1618522427 ecr 42718161,nop,wscale 13], length 0
20:45:25.621252 enp37s0 In  IP (tos 0x0, ttl 54, id 0, offset 0, flags [DF], proto TCP (6), length 60)
    1.1.1.1.443 > 192.168.1.2.62893: Flags [S.], cksum 0x45d7 (correct), seq 2995704351, ack 42718143, win 65535, options [mss 1452,sackOK,TS val 1618523447 ecr 42718161,nop,wscale 13], length 0
00:49:04.680091 enp37s0 Out IP (tos 0x0, ttl 64, id 15656, offset 0, flags [none], proto TCP (6), length 60)
    192.168.1.2.51212 > 1.1.1.1.443: Flags [S], cksum 0xdaab (correct), seq 57338245, win 65535, options [mss 1460,sackOK,TS val 57338253 ecr 0,wscale 7,eol], length 0
00:49:04.693194 enp37s0 In  IP (tos 0x0, ttl 53, id 0, offset 0, flags [DF], proto TCP (6), length 60)
    1.1.1.1.443 > 192.168.1.2.51212: Flags [S.], cksum 0x72fa (correct), seq 44273329, ack 57338246, win 65535, options [mss 1452,sackOK,TS val 2563261310 ecr 57338253,nop,wscale 13], length 0
00:49:05.740565 enp37s0 In  IP (tos 0x0, ttl 53, id 0, offset 0, flags [DF], proto TCP (6), length 60)
    1.1.1.1.443 > 192.168.1.2.51212: Flags [S.], cksum 0x6ee2 (correct), seq 44273329, ack 57338246, win 65535, options [mss 1452,sackOK,TS val 2563262358 ecr 57338253,nop,wscale 13], length 0
00:50:19.153823 enp37s0 Out IP (tos 0x0, ttl 64, id 36489, offset 0, flags [none], proto TCP (6), length 60)
    192.168.1.2.59948 > 1.1.1.1.443: Flags [S], cksum 0x72b7 (correct), seq 57412718, win 65535, options [mss 1460,sackOK,TS val 57412726 ecr 0,wscale 7,eol], length 0
00:50:19.164701 enp37s0 In  IP (tos 0x0, ttl 54, id 0, offset 0, flags [DF], proto TCP (6), length 60)
    1.1.1.1.443 > 192.168.1.2.59948: Flags [S.], cksum 0x2e2d (correct), seq 1978975882, ack 57412719, win 65535, options [mss 1452,sackOK,TS val 3231534423 ecr 57412726,nop,wscale 13], length 0
00:50:20.176990 enp37s0 In  IP (tos 0x0, ttl 54, id 0, offset 0, flags [DF], proto TCP (6), length 60)
    1.1.1.1.443 > 192.168.1.2.59948: Flags [S.], cksum 0x2a38 (correct), seq 1978975882, ack 57412719, win 65535, options [mss 1452,sackOK,TS val 3231535436 ecr 57412726,nop,wscale 13], length 0
00:55:41.133209 enp37s0 Out IP (tos 0x0, ttl 64, id 31464, offset 0, flags [none], proto TCP (6), length 60)
    192.168.1.2.62531 > 1.1.1.1.443: Flags [S], cksum 0x9521 (correct), seq 57734695, win 65535, options [mss 1460,sackOK,TS val 57734706 ecr 0,wscale 7,eol], length 0
00:55:41.145748 enp37s0 In  IP (tos 0x0, ttl 53, id 0, offset 0, flags [DF], proto TCP (6), length 60)
    1.1.1.1.443 > 192.168.1.2.62531: Flags [S.], cksum 0x8f85 (correct), seq 753437317, ack 57734696, win 65535, options [mss 1452,sackOK,TS val 1046091198 ecr 57734706,nop,wscale 13], length 0
00:55:42.191327 enp37s0 In  IP (tos 0x0, ttl 53, id 0, offset 0, flags [DF], proto TCP (6), length 60)
    1.1.1.1.443 > 192.168.1.2.62531: Flags [S.], cksum 0x8b6f (correct), seq 753437317, ack 57734696, win 65535, options [mss 1452,sackOK,TS val 1046092244 ecr 57734706,nop,wscale 13], length 0
03:15:42.397949 enp37s0 Out IP (tos 0x0, ttl 64, id 23258, offset 0, flags [none], proto TCP (6), length 60)
    192.168.1.2.49979 > 1.1.1.1.443: Flags [S], cksum 0x66b1 (correct), seq 66135393, win 65535, options [mss 1460,sackOK,TS val 66135408 ecr 0,wscale 7,eol], length 0
03:15:42.408876 enp37s0 In  IP (tos 0x0, ttl 54, id 0, offset 0, flags [DF], proto TCP (6), length 60)
    1.1.1.1.443 > 192.168.1.2.49979: Flags [S.], cksum 0x245d (correct), seq 1687137273, ack 66135394, win 65535, options [mss 1452,sackOK,TS val 2236396136 ecr 66135408,nop,wscale 13], length 0
03:15:43.446208 enp37s0 In  IP (tos 0x0, ttl 54, id 0, offset 0, flags [DF], proto TCP (6), length 60)
    1.1.1.1.443 > 192.168.1.2.49979: Flags [S.], cksum 0x204f (correct), seq 1687137273, ack 66135394, win 65535, options [mss 1452,sackOK,TS val 2236397174 ecr 66135408,nop,wscale 13], length 0
03:19:12.081888 enp37s0 Out IP (tos 0x0, ttl 64, id 52544, offset 0, flags [none], proto TCP (6), length 60)
    192.168.1.2.56297 > 1.1.1.1.443: Flags [S], cksum 0xe7d2 (correct), seq 66345079, win 65535, options [mss 1460,sackOK,TS val 66345092 ecr 0,wscale 7,eol], length 0
03:19:12.091566 enp37s0 In  IP (tos 0x0, ttl 53, id 0, offset 0, flags [DF], proto TCP (6), length 60)
    1.1.1.1.443 > 192.168.1.2.56297: Flags [S.], cksum 0x2e3a (correct), seq 4106119478, ack 66345080, win 65535, options [mss 1452,sackOK,TS val 1247156023 ecr 66345092,nop,wscale 13], length 0
03:19:13.126235 enp37s0 In  IP (tos 0x0, ttl 53, id 0, offset 0, flags [DF], proto TCP (6), length 60)
    1.1.1.1.443 > 192.168.1.2.56297: Flags [S.], cksum 0x2a2f (correct), seq 4106119478, ack 66345080, win 65535, options [mss 1452,sackOK,TS val 1247157058 ecr 66345092,nop,wscale 13], length 0
03:23:16.458945 enp37s0 Out IP (tos 0x0, ttl 64, id 42515, offset 0, flags [none], proto TCP (6), length 60)
    192.168.1.2.54224 > 1.1.1.1.443: Flags [S], cksum 0x7ab1 (correct), seq 66589457, win 65535, options [mss 1460,sackOK,TS val 66589469 ecr 0,wscale 7,eol], length 0
03:23:16.469972 enp37s0 In  IP (tos 0x0, ttl 54, id 0, offset 0, flags [DF], proto TCP (6), length 60)
    1.1.1.1.443 > 192.168.1.2.54224: Flags [S.], cksum 0x9a44 (correct), seq 1594423150, ack 66589458, win 65535, options [mss 1452,sackOK,TS val 2360279856 ecr 66589469,nop,wscale 13], length 0
03:23:16.470264 enp37s0 Out IP (tos 0x0, ttl 64, id 42524, offset 0, flags [none], proto TCP (6), length 52)
    192.168.1.2.54224 > 1.1.1.1.443: Flags [.], cksum 0xc90d (correct), ack 1594423151, win 65535, options [nop,nop,TS val 66589470 ecr 2360279856], length 0
03:23:16.488935 enp37s0 Out IP (tos 0x0, ttl 64, id 42533, offset 0, flags [none], proto TCP (6), length 1476)
    192.168.1.2.54224 > 1.1.1.1.443: Flags [P.], cksum 0xaacb (correct), seq 66589458:66590882, ack 1594423151, win 65535, options [nop,nop,TS val 66589471 ecr 2360279856], length 1424
03:23:16.500009 enp37s0 In  IP (tos 0x0, ttl 54, id 39027, offset 0, flags [DF], proto TCP (6), length 52)
    1.1.1.1.443 > 192.168.1.2.54224: Flags [.], cksum 0xc34d (correct), ack 66590882, win 17, options [nop,nop,TS val 2360279886 ecr 66589471], length 0
03:23:16.501742 enp37s0 In  IP (tos 0x0, ttl 54, id 39028, offset 0, flags [DF], proto TCP (6), length 59)
    1.1.1.1.443 > 192.168.1.2.54224: Flags [P.], cksum 0x7738 (correct), seq 1594423151:1594423158, ack 66590882, win 17, options [nop,nop,TS val 2360279887 ecr 66589471], length 7
03:23:16.502471 enp37s0 In  IP (tos 0x0, ttl 54, id 39029, offset 0, flags [DF], proto TCP (6), length 52)
    1.1.1.1.443 > 192.168.1.2.54224: Flags [F.], cksum 0xc343 (correct), seq 1594423158, ack 66590882, win 17, options [nop,nop,TS val 2360279888 ecr 66589471], length 0
03:23:16.527932 enp37s0 In  IP (tos 0x0, ttl 54, id 39030, offset 0, flags [DF], proto TCP (6), length 52)
    1.1.1.1.443 > 192.168.1.2.54224: Flags [F.], cksum 0xc329 (correct), seq 1594423158, ack 66590882, win 17, options [nop,nop,TS val 2360279914 ecr 66589471], length 0
03:23:16.743952 enp37s0 In  IP (tos 0x0, ttl 54, id 39031, offset 0, flags [DF], proto TCP (6), length 59)
    1.1.1.1.443 > 192.168.1.2.54224: Flags [FP.], cksum 0x7644 (correct), seq 1594423151:1594423158, ack 66590882, win 17, options [nop,nop,TS val 2360280130 ecr 66589471], length 7
03:23:17.176966 enp37s0 In  IP (tos 0x0, ttl 54, id 39032, offset 0, flags [DF], proto TCP (6), length 59)
    1.1.1.1.443 > 192.168.1.2.54224: Flags [FP.], cksum 0x7493 (correct), seq 1594423151:1594423158, ack 66590882, win 17, options [nop,nop,TS val 2360280563 ecr 66589471], length 7
03:30:26.786876 enp37s0 Out IP (tos 0x0, ttl 64, id 45587, offset 0, flags [none], proto TCP (6), length 60)
    192.168.1.2.64385 > 1.1.1.1.443: Flags [S], cksum 0x3103 (correct), seq 67019785, win 65535, options [mss 1460,sackOK,TS val 67019797 ecr 0,wscale 7,eol], length 0
03:30:26.799044 enp37s0 In  IP (tos 0x0, ttl 54, id 0, offset 0, flags [DF], proto TCP (6), length 60)
    1.1.1.1.443 > 192.168.1.2.64385: Flags [S.], cksum 0x97d3 (correct), seq 1813933044, ack 67019786, win 65535, options [mss 1452,sackOK,TS val 3896237770 ecr 67019797,nop,wscale 13], length 0
03:30:26.799274 enp37s0 Out IP (tos 0x0, ttl 64, id 45595, offset 0, flags [none], proto TCP (6), length 52)
    192.168.1.2.64385 > 1.1.1.1.443: Flags [.], cksum 0xc69c (correct), ack 1813933045, win 65535, options [nop,nop,TS val 67019798 ecr 3896237770], length 0
03:30:26.812487 enp37s0 Out IP (tos 0x0, ttl 64, id 45600, offset 0, flags [none], proto TCP (6), length 1476)
    192.168.1.2.64385 > 1.1.1.1.443: Flags [P.], cksum 0x5c74 (correct), seq 67019786:67021210, ack 1813933045, win 65535, options [nop,nop,TS val 67019799 ecr 3896237770], length 1424
03:30:26.824595 enp37s0 In  IP (tos 0x0, ttl 54, id 4588, offset 0, flags [DF], proto TCP (6), length 52)
    1.1.1.1.443 > 192.168.1.2.64385: Flags [.], cksum 0xc0e0 (correct), ack 67021210, win 17, options [nop,nop,TS val 3896237796 ecr 67019799], length 0
03:3